author	clean_title	created_utc	domain	hasImage	id	image_url	linked_submission_id	num_comments	score	subreddit	title	upvote_ratio	2_way_label	3_way_label	6_way_label
SFepicure	ivanka trump and jared kushner were repeatedly rejected when they tried to fly on air force planes so they found a workaround	1552355494.0	businessinsider.com	True	b01zag	https://external-preview.redd.it/b-ycQxesAla_nZjRNDohtUQ5miYEjJsdE3ZRM3J4H00.jpg?width=320&crop=smart&auto=webp&s=ef495491a61476be149cace835e11ffd5718f24b		5.0	54	neutralnews	Ivanka Trump and Jared Kushner were repeatedly rejected when they tried to fly on Air Force planes, so they found a workaround	0.75	1	0	0
ujzzz	japanese delivery workers stretching	1497332211.0	assets.bwbx.io	True	6gxx6h	https://external-preview.redd.it/--_OykFl9gyst8kMTXDXGpHFhG7xTrc8eH0pQ0E1s50.jpg?width=320&crop=smart&auto=webp&s=b332cbb5b5831e8eb174e0bde49f76b12c312993		6.0	4	photoshopbattles	PsBattle: Japanese delivery workers stretching	0.84	1	0	0
QuantumOfSilence	someone put a green army toy on a green giant can	1571489583.0	i.redd.it	True	dk3djp	https://preview.redd.it/2lvbme9uvht31.jpg?width=320&crop=smart&auto=webp&s=bc562136954836dd7c540f69e5cb3bdda82837a9		7.0	43	mildlyinteresting	Someone put a green army toy on a Green Giant can.	0.74	1	0	0
taway2914	tennessee cop fired after shooting pepper spraying squirrel	1397902618.0	upi.com	True	23fed6	https://external-preview.redd.it/PKaGBmR4EYHMOEgRtrX4DWzAs5ksIU_eJbFxVpbyd1E.jpg?width=320&crop=smart&auto=webp&s=82737f32be10fa74b34144de4907cfe4f66b70a0		21.0	361	nottheonion	Tennessee cop fired after shooting, pepper spraying squirrel	0.96	1	0	0
Toriganator	this guy fishing in a storm	1494684351.0	i.redd.it	True	6axznn	https://preview.redd.it/zgb0s0hgy9xy.jpg?width=320&crop=smart&auto=webp&s=e4707e4b6a769b0634f392897008577beaf242ed		2.0	5	photoshopbattles	PsBattle: this guy fishing in a storm.	0.78	1	0	0
SuperNinja2019	a stare down between bb and adam driver	1451806587.0	i.imgur.com	True	3z90id	https://external-preview.redd.it/REumejDzpM7MAyofr-KEUG07B2bOwAZZo_i5AZ7aEQU.jpg?width=320&crop=smart&auto=webp&s=4f10083886d04d2e8e7a4007ab71ee188a41b224		335.0	6527	photoshopbattles	PsBattle: A stare down between BB-8 and Adam Driver.	0.91	1	0	0
menmybabies	new treatment for tourette syndrome changes boys life	1388597247.0	gma.yahoo.com	True	1u5zk6	https://external-preview.redd.it/1SsYz6hgBkLdYIy-_fsiHwumgOSkJesg8TbQyhlNnCE.jpg?width=320&crop=smart&auto=webp&s=fd9ebad5abd021ffaecd2d7532d5333cd7985541		1.0	34	upliftingnews	New Treatment for Tourette Syndrome Changes Boy's Life	0.97	1	0	0
hounddognewschaser	across china girl rescues trafficked woman on train	1430707399.0	news.xinhuanet.com	True	34s72p	https://external-preview.redd.it/CNRMqSCbpxUeNyw4SL_QWAfbyDGb-QUNMW_lbUFVldg.jpg?width=108&crop=smart&auto=webp&s=d772aa9262deedb21284172ec7c6ea06cf99f447		2.0	24	upliftingnews	Across China: Girl rescues trafficked woman on train	0.9	1	0	0
theflavster	fat orange cat	1483665947.0	i.reddituploads.com	True	5makvp	https://external-preview.redd.it/S7p0BjLkynQEQix8bhariFfoH8C2s6380LyAwVrFBic.jpg?width=320&crop=smart&auto=webp&s=5b80fc8308a39b05e378b60b00dea4382f21b9a7		1.0	7	photoshopbattles	PsBattle: Fat Orange Cat	0.78	1	0	0
bigpizza87	accurate name for a love motel	1570787084.0	i.redd.it	True	dgcsey	https://preview.redd.it/0a80cb4yuvr31.jpg?width=320&crop=smart&auto=webp&s=39dd877f61e058d685a18b9fe47d240e758b9cca		0.0	16	mildlyinteresting	Accurate name for a love motel	0.94	1	0	0
jcmonk	two high school seniors buy a new bike for their freshman teammate after his was stolen	1570194506.0	wtol.com	True	dd74yn	https://external-preview.redd.it/9DmTwTtEHJC1Wf1_aRP8Xo78pMX2mq-mucJKPl9aBkU.jpg?width=320&crop=smart&auto=webp&s=5ee32baccae96d21fea29c864f58cdca83d59e8c		5.0	107	upliftingnews	Two high school seniors buy a new bike for their freshman teammate after his was stolen	0.93	1	0	0
Jamie919191	boris johnson rugby run	1444905853.0	i.imgur.com	True	3oubnb	https://external-preview.redd.it/2eX3rTIzTJiYxprGcYiI8HTaPs5dkS_D2h6C_1myRN8.jpg?width=320&crop=smart&auto=webp&s=d0de3244a4350ab033ec552588fedeca4b64b1cf		3.0	11	photoshopbattles	PsBattle: Boris Johnson rugby run!	0.76	1	0	0
DYNAMICRICK	this unique carrot	1517711809.0	i.redd.it	True	7v428x	https://preview.redd.it/mwa002wwy3e01.jpg?width=320&crop=smart&auto=webp&s=4ccfa55c964ebcb4aba678322662e5869fb5fffd		10.0	11	photoshopbattles	PsBattle: This unique carrot	0.68	1	0	0
creature666	alligators drugs and theft oh my new list shows top florida man stories	1551703195.0	npr.org	True	ax6oyg	https://external-preview.redd.it/nr1_s3tGAz9F6JVOVrYQBaMs347wiOR1HZgXu2KHIxk.jpg?width=320&crop=smart&auto=webp&s=439ce1699d762067d4a86af5017f1e3fa96678d3		1.0	7	usnews	Alligators, Drugs, And Theft, Oh My! New List Shows Top 10 'Florida Man' Stories	0.74	1	0	0
DonaldJW	this signs all slanted to the right	1557355833.0	i.redd.it	True	bmc2dd	https://preview.redd.it/h6a25flwg2x21.jpg?width=320&crop=smart&auto=webp&s=f7ef54171f4fae69869b827970b30e1c1b45b1cb		4.0	10	mildlyinteresting	This signs all slanted to the right	0.83	1	0	0
	french presidential race tightens further as vote nears	1492233739.0	theepochtimes.com	True	65hja8	https://external-preview.redd.it/KX8K91LRgjWaoi494ucxQF9zIyr-pBzpR8T-HQT5394.jpg?width=320&crop=smart&auto=webp&s=ecc3b49b4fd463fe7feea126f0066d89618b7990		1.0	23	neutralnews	French Presidential Race Tightens Further as Vote Nears	0.89	1	0	0
	stan lee meeting stan lee	1512520651.0	i.redd.it	True	7hu9bu	https://preview.redd.it/myipjpqx67201.jpg?width=320&crop=smart&auto=webp&s=97cf64d3d2d2f23640d506edad47602a32ffeaf5		468.0	35873	photoshopbattles	PsBattle: Stan Lee meeting Stan Lee	0.93	1	0	0
Cronomonkey	kid running at summer camp	1482351511.0	i.imgur.com	True	5jm520	https://external-preview.redd.it/cDjPSxWFwKMqpSELrKsTsp8Lp-1L2TUDFh90vmr9XEg.jpg?width=320&crop=smart&auto=webp&s=dc0bcb30a676149e089bb316bfa470e053d22911		4.0	5	photoshopbattles	PsBattle: Kid running at summer camp.	0.73	1	0	0
crazyunit405	this banana and its conjoined twin	1567522522.0	i.redd.it	True	cz5y5f	https://preview.redd.it/75o9za4q7ek31.jpg?width=320&crop=smart&auto=webp&s=adf9016aa710644b674d5c2f7a4ea50985177048		2.0	10	mildlyinteresting	This banana and its conjoined twin.	0.74	1	0	0
hipointhipshooter	got a morgan dollar in my change today super neat	1570985966.0	i.redd.it	True	dhd6eu	https://preview.redd.it/6nlkgqibacs31.jpg?width=320&crop=smart&auto=webp&s=1d1acd267b631e5d02765b39c8ccc6b62e655ac8		16.0	85	mildlyinteresting	Got a 1921 Morgan dollar in my change today. Super neat.	0.95	1	0	0
SackJnyder	my local grocery store named the isles after streets in my town	1566700190.0	i.redd.it	True	cv2w05	https://preview.redd.it/706wijmhaii31.jpg?width=320&crop=smart&auto=webp&s=dc8c12a2d0a646657f649aa2de994903b3f5975b		2.0	18	mildlyinteresting	My local grocery store named the isles after streets in my town.	0.92	1	0	0
iseecarbonpeople	our emergency medical centre employs the finn scale now	1557829644.0	i.redd.it	True	boh4ta	https://preview.redd.it/lnc4vyltl5y21.jpg?width=320&crop=smart&auto=webp&s=9ef01bda36429c7a5b30fde86a3dfc44666a505f		65.0	2536	mildlyinteresting	Our emergency medical centre employs the Finn Scale now	0.97	1	0	0
Typefaec	police called to masked men smashing cars but discover a filming session for a rap video	1454778406.0	manchestereveningnews.co.uk	True	44h113	https://external-preview.redd.it/ScFug6y4aQqyCHjI3ZBJdR7hkT_eT1VQ47fS5eDM8Do.jpg?width=320&crop=smart&auto=webp&s=29e74d4eb32e241bec3be8fa17587eb5b6d8491e		11.0	372	nottheonion	Police called to '30 masked men smashing cars' - but discover a filming session for a rap video	0.92	1	0	0
funnyfaceking	lovestruck witness in baby murder trial tries to contact juror through craigslist	1397363950.0	lehighvalleylive.com	True	22wk57	https://external-preview.redd.it/CL9xl75_3Dvmf1Z6yLD0OEa9rC_FAamlKALlBy7-HnY.jpg?width=320&crop=smart&auto=webp&s=a61ce54af4e0c1953baf5af39c3d21d84fa50767		0.0	11	nottheonion	Lovestruck witness in baby murder trial tries to contact juror through Craigslist	0.99	1	0	0
Explosive_	four golfers on the australian coast	1379558830.0	i.imgur.com	True	1moqw9	https://external-preview.redd.it/82j49Beioy1n0YKr3Wuh3pJSnXmZXbrKZc1DgjA2k9M.jpg?width=320&crop=smart&auto=webp&s=58c59e818121b38dc81fc4034eccdb5cd4202db5		6.0	3	photoshopbattles	Four golfers on the Australian Coast	1.0	1	0	0
superflippy	john boehner in an ugly sweater fixed	1352308128.0	i.imgur.com	True	12szw7	https://external-preview.redd.it/03V2UoryDa3C3BpsghvwgLM1BX0fJiIm4GIeFGgrYRQ.jpg?width=320&crop=smart&auto=webp&s=282b1bb59b07f5398db7c39301968bc803bb678e		7.0	3	photoshopbattles	John Boehner in an ugly sweater [FIXED]	0.71	1	0	0
mcblibla69	the grapefruit seeds started sprouting	1556211434.0	i.redd.it	True	bhb048	https://preview.redd.it/c6wjad02yfu21.jpg?width=320&crop=smart&auto=webp&s=bebc00ff5abb917529df4455e80d276509145db9		12.0	10	mildlyinteresting	The grapefruit seeds started sprouting	0.85	1	0	0
ElectricEntity	a woman in brazil was robbed on live tv while giving an interview about robberies in brazil	1397250897.0	globalpost.com	True	22t4nz	https://external-preview.redd.it/Gr3cWoGYoX8tpbNBOoJ6VvZgBygQGCnhWxEhuF4JYDM.jpg?width=320&crop=smart&auto=webp&s=622007533ee636c975ee0932b35ae713eb97e08b		84.0	898	nottheonion	A woman in Brazil was robbed on live TV while giving an interview about robberies in Brazil	0.94	1	0	0
jaj-io	this elevator opens with a door handle	1551406478.0	i.redd.it	True	avz9as	https://preview.redd.it/iijj74fg2fj21.jpg?width=320&crop=smart&auto=webp&s=f1ad4afa9d42e8a3f685b722ad58d608137716d4		3.0	36	mildlyinteresting	This elevator opens with a door handle	0.91	1	0	0
Dandan419	this steakhouse i went to puts ice in their urinals supposedly it works better than urinal cakes because it flushed the pee as it melts	1555813678.0	i.redd.it	True	bfk5s4	https://preview.redd.it/tnzefqsb3jt21.jpg?width=320&crop=smart&auto=webp&s=1e2e383a4e1a52d1e94b08458bd92cb2c37be3f0		4.0	10	mildlyinteresting	This steakhouse I went to puts ice in their urinals... supposedly it works better than urinal cakes, because it flushed the pee as it melts?	0.79	1	0	0
ColinW0805	dog covered in dirt	1474844882.0	i.imgur.com	True	54hof5	https://external-preview.redd.it/Ru8yN39NwDrq3BRFfFwQPaFZpnMFjCPaftqmdF7ZMv0.jpg?width=320&crop=smart&auto=webp&s=3c6f49c6a65c97d75bebe89ad0b2ce2d01d949d9		3.0	9	photoshopbattles	PsBattle: Dog Covered in Dirt	0.91	1	0	0
washheightsboy3	ohio teen zaps cop with stun gun to fulfill bucketlist wish	1485812415.0	m.timesunion.com	True	5r3rl8	https://external-preview.redd.it/BVgE85iPyXtN_p16cIU02CtQnYATCelTosGfGkL8UTw.jpg?width=320&crop=smart&auto=webp&s=351008062e00d7957e33198f36c524307fc5bdce		2.0	22	upliftingnews	Ohio teen zaps cop with stun gun to fulfill bucket-list wish	0.85	1	0	0
conuly	navy trump planning biggest fleet expansion since cold war	1483932103.0	apnewsarchive.com	True	5mvay3	https://external-preview.redd.it/K9a5X4oJnk8_o2dlWwf24fM0oHFEudF16sF4LLH1RGU.jpg?width=320&crop=smart&auto=webp&s=875f65d95f73dc64b6a510921d3ede7cc8ecd6d2		2.0	5	usnews	Navy, Trump planning biggest fleet expansion since Cold War	0.79	1	0	0
mountainking	batman charged with obstructing michigan police	1364663010.0	usnews.com	True	1bb5ci	https://external-preview.redd.it/T_jYundZdJfScNTJzFYOwyj89yy9YLCtuwS3MN7umMI.jpg?width=320&crop=smart&auto=webp&s=ec895aad4e3a577eb1c8e1d7a7d804abe42ea908		3.0	47	nottheonion	'Batman' Charged With Obstructing Michigan Police	0.89	1	0	0
ABKB	olive garden apologizes to kc police officer asked to leave because he was armed	1444759195.0	kansascity.com	True	3om4ff	https://external-preview.redd.it/TR0VrqpqOfESJ-aTptKNb-Ro3Mvlv5F62CsmZGgm3y8.jpg?width=320&crop=smart&auto=webp&s=f7bca04f83aaf094cb470266c2532f19a91a5022		14.0	10	nottheonion	Olive Garden apologizes to KC police officer asked to leave because he was armed	0.69	1	0	0
	ice transfers immigrants held in detention around the country to keep beds filled then it releases them with no help getting home	1505714319.0	denverpost.com	True	70t3x5	https://external-preview.redd.it/6h52pckNPakElJwtZ95q8P2Axhy7NyPpBm2OsNeBsxY.jpg?width=320&crop=smart&auto=webp&s=05880be724117031fe6a778873724d08b5c8e1dd		0.0	4	usanews	ICE transfers immigrants held in detention around the country to keep beds filled. Then it releases them, with no help getting home.	0.63	1	0	0
zaklein	playboyposing veteran arrested in flag scuffle sets off debate over everything	1429551840.0	washingtonpost.com	True	339918	https://external-preview.redd.it/4-bDBCtwD9WQGl1OhcoSjs5q0Kc2yzWSONQholD_QJI.jpg?width=320&crop=smart&auto=webp&s=655d4896ad51b5728262952477f19d58f4a3f3fd		8.0	9	nottheonion	Playboy-posing veteran arrested in flag scuffle, sets off debate over everything	0.85	1	0	0
TheGhostOfTzvika	americas crumbling infrastructure bridging the gap for a country where everyone drives america has shoddy roads	1404083184.0	economist.com	True	29fens	https://external-preview.redd.it/Ch5HnVFI4NYD0FcvISKHbGHcXSAfnewiMZu9ZmqDsoo.jpg?width=320&crop=smart&auto=webp&s=ff24e36a927a5938690ae1d2c61c477621229432		1.0	2	usanews	America’s crumbling infrastructure: Bridging the gap -- For a country where everyone drives, America has shoddy roads	0.76	1	0	0
co1063	this library has a machine that sterilizes books	1563183973.0	i.redd.it	True	cdfg7c	https://preview.redd.it/zjh94hkzufa31.jpg?width=320&crop=smart&auto=webp&s=ddbdfc3484918823d6a08ec04aa91bdaad79de38		6.0	16	mildlyinteresting	This library has a machine that sterilizes books	0.91	1	0	0
RoccoPurnell	saw these poles earlier	1569706641.0	i.redd.it	True	dam8t9	https://preview.redd.it/rwx2ccs8mep31.jpg?width=320&crop=smart&auto=webp&s=4d4749b9e111c7e8041f7720baafda38a8c7fd86		8.0	4	mildlyinteresting	Saw these poles earlier	0.67	1	0	0
PMaT26oo	my dad running in a field	1413005530.0	i.imgur.com	True	2ixax4	https://external-preview.redd.it/XppCuoi6GodXVWhvZQwA24lzpf3hWG7zL-nxKbO4XsA.jpg?width=320&crop=smart&auto=webp&s=671ae45ae1748956c56cbf531aff8db4f41a5177		2.0	2	photoshopbattles	PsBattle: My dad running in a field...	0.67	1	0	0
rex-the-wolf12	my dad just went to the doctor for a health check and they took a whole body xray and a d scan of him	1559917621.0	i.redd.it	True	bxv8px	https://preview.redd.it/bul0qn9g2y231.jpg?width=320&crop=smart&auto=webp&s=2754433464cbbcf2b34ba9a6467ddca3d466a3a8		9.0	17	mildlyinteresting	My dad just went to the doctor for a health check and they took a whole body x-ray and a 3d scan of him	0.8	1	0	0
royfus4u	my ibuprofen gel caps melted together after leaving them in my car	1567926085.0	imgur.com	True	d17r7w	https://external-preview.redd.it/TYZYvhl5s8PmE3UQDns9hTqaPX4a65kw09V2faejwLs.jpg?width=320&crop=smart&auto=webp&s=7924eb3cef5423672553c816906d663a7a887612		12.0	21	mildlyinteresting	My ibuprofen gel caps melted together after leaving them in my car.	0.93	1	0	0
juju95	happy kim jong un and friends	1425281632.0	i.imgur.com	True	2xndhm	https://external-preview.redd.it/_xSpO56U24OKg3qy7fg6BqL3GvCpWC2vKDy15mFzak4.jpg?width=320&crop=smart&auto=webp&s=e53a0a8fb1987813744ec6d6c470a8df0c8477ec		7.0	4	photoshopbattles	PsBattle: Happy Kim Jong Un and friends	1.0	1	0	0
CaptainMGTOW	undercover windows xp logo	1537630156.0	i.redd.it	True	9i0iia	https://preview.redd.it/cuytr5zc6tn11.jpg?width=320&crop=smart&auto=webp&s=ddcada31f8755f43721dc2805e2647e6e902f874		0.0	9	mildlyinteresting	Undercover Windows XP logo	0.84	1	0	0
DonnyisVladdysboy	my emblem got absolutely wrecked in the rainstorms lately	1537116239.0	imgur.com	True	9gc0a6	https://external-preview.redd.it/VYjatYv8G27RYL5QzHHAqSs5PunUetVjybFa3_qyzi0.jpg?width=320&crop=smart&auto=webp&s=f51c702880981a0f7147f486f50a38786b2afa41		22.0	3	mildlyinteresting	My emblem got absolutely wrecked in the rainstorms lately	0.58	1	0	0
metalmiltofrand	this subaru reddit guy i found at my uni today	1571705031.0	i.redd.it	True	dl9xh7	https://preview.redd.it/lrv3ou5hozt31.jpg?width=320&crop=smart&auto=webp&s=32e055bc91bffc893f5926488ecfcc5950c4b010		4.0	23	mildlyinteresting	This Subaru Reddit Guy I found at my Uni today	0.83	1	0	0
311j	a school attempted to teach kids about bullying by letting them get bullied	1453645775.0	i100.independent.co.uk	True	42g1cc	https://external-preview.redd.it/FwhK4kLD2qI4wZetbI_o0VUwcke6ddPXEPpuSH2Et9Y.jpg?width=320&crop=smart&auto=webp&s=d4f1f0e3cc33cb4e82f9248a085c21f16e0476a1		595.0	3373	nottheonion	A school attempted to teach kids about bullying by letting them get bullied	0.87	1	0	0
Echotuft	the same stuffed animal a year apart new one on the left	1567634454.0	i.redd.it	True	czrimc	https://preview.redd.it/qzjx4apignk31.jpg?width=320&crop=smart&auto=webp&s=5884752d750ffcae478d84c10e17a75e6e7341b9		8.0	11	mildlyinteresting	The same stuffed animal, a year apart. (New one on the left)	0.93	1	0	0
AsariCommando2	old ladies doing tai chi	1508599370.0	post-gazette.com	True	77tz21	https://external-preview.redd.it/Eq53cYRZH3qoHH0ntPkD3pcw2oXFvWVT98hBwvyDm_Y.jpg?width=320&crop=smart&auto=webp&s=11746226bc898006b32af5dfc8a0eb3f7ddbf22d		1.0	10	photoshopbattles	PsBattle: Old ladies doing Tai Chi	0.82	1	0	0
GargantuanAnt	this manpig halloween costume	1492987984.0	i.reddituploads.com	True	675bcp	https://external-preview.redd.it/hOapOKAcrtvz4pvVsmUqNeNWgHfZJHt1dUDxurKeOKo.jpg?width=320&crop=smart&auto=webp&s=5bd6a21fc86ea0ef794138fe435be28270fefab8		2.0	3	photoshopbattles	PsBattle: This Man-Pig Halloween Costume.	0.8	1	0	0
Karranas	accidental voicemail catches rcmp mocking assault complainant	1396377701.0	cbc.ca	True	21y1v3	https://external-preview.redd.it/-LJ7Nu5rGagOeXs3gcieVishyOIHNRb25sQN53ZQFCs.jpg?width=320&crop=smart&auto=webp&s=0ae2598aeb6038be6bb3ad266ffe81adb037c6da		0.0	2	nottheonion	Accidental voicemail catches RCMP mocking assault complainant	1.0	1	0	0
RaverChild69	pornhub to open erotic nyc shop with livestreaming bed videocam	1511531076.0	foxnews.com	True	7f7jy2	https://external-preview.redd.it/lEFGYyru5AmHxu8FIZ2htNNH8dA5xZAjXzZn_yH_v9s.jpg?width=320&crop=smart&auto=webp&s=e9d4f6c70b03b3f920963a0429dd3e624259f5e1		1.0	18	usnews	Pornhub to open erotic NYC shop with live-streaming bed videocam	0.78	1	0	0
GoldieNYC1010	yearold woman praying in nyc chuch punched told to shut up police	1553779482.0	nbcnewyork.com	True	b6ir1m	https://external-preview.redd.it/N6MZU-Gg3Rm4DQ7h_nRFpDiJiXfzQE1OfnwcNSscBxQ.jpg?width=320&crop=smart&auto=webp&s=297513b86858333874a617f72565b44b4dab75ee		3.0	22	nottheonion	70-Year-Old Woman Praying in NYC Chuch Punched, Told to Shut Up: Police	0.91	1	0	0
Supersquirrel2	focused dodgeball stance	1506020198.0	i.redd.it	True	71lcqi	https://preview.redd.it/9u6m86no8anz.png?width=320&crop=smart&auto=webp&s=8c4b1ea9d93dbec03a604c274e8296eb656c2f25		1.0	3	photoshopbattles	PsBattle: Focused Dodgeball Stance	0.64	1	0	0
peanutcrackers	for chinese tourists behaving badly a government blacklist	1431349622.0	npr.org	True	35lbs7	https://external-preview.redd.it/-GQNbuLRD7OObcYsjk9VUbEutj7Hl8E32YkNBzDJPR0.jpg?width=320&crop=smart&auto=webp&s=b2a9c0d6eb22d9387a1d4d4b097b94223db60e6c		1.0	5	nottheonion	For Chinese Tourists Behaving Badly, A Government Blacklist	1.0	1	0	0
kinsey3	mother arrested for dropping fbomb on her kids in public	1408147642.0	fox40.com	True	2dokj6	https://external-preview.redd.it/MlQiiYW1Q1Cc6OPMste6w7FpcR0qma8MAJRjM4CfMyQ.jpg?width=320&crop=smart&auto=webp&s=ad431022fcd2eb7a817c2e65c60a8aeed0014eed		2.0	4	nottheonion	Mother Arrested for Dropping F-Bomb on her Kids in Public	0.75	1	0	0
MuddySon	people still try to push on this urinal sticker saying its an automatic flush thinking its the flush button	1556759435.0	i.redd.it	True	bjp1qf	https://preview.redd.it/q2k6c0vj7pv21.jpg?width=320&crop=smart&auto=webp&s=7e196649dfc64b4f090e7701ffbae446328f12e2		3.0	28	mildlyinteresting	People still try to push on this urinal sticker saying it’s an automatic flush thinking it’s the flush button.	0.95	1	0	0
Verbruggy	a picture i took of a fungus through a microscope at school	1570517842.0	i.redd.it	True	deweyt	https://preview.redd.it/uz7n00rcm9r31.jpg?width=320&crop=smart&auto=webp&s=303103acaa7cb310a8fc7ed71a6b03516f855803		4.0	7	mildlyinteresting	A picture i took of a fungus through a microscope at school	0.74	1	0	0
FieryAlex	found this at cracker barrel	1556518300.0	i.redd.it	True	bim5xn	https://preview.redd.it/oyh3favia5v21.jpg?width=320&crop=smart&auto=webp&s=9720131f0b9ff1ca44bc90672f58f656e6ac2a06		3.0	8	mildlyinteresting	Found This At Cracker Barrel.	0.79	1	0	0
TheSwiftClick	this bad boy who is enjoying summer with sunglasses and a snarl	1532469406.0	i.redd.it	True	91ltja	https://preview.redd.it/zs7qmdttwyb11.jpg?width=320&crop=smart&auto=webp&s=8a788ba138d769fd75c0f1c0d2ebf8e151aaa2fa		2.0	7	photoshopbattles	PsBattle: This bad boy who is enjoying summer with sunglasses and a snarl	1.0	1	0	0
lzenker123	lucys shadow looks somewhat like yodas head shape	1569182914.0	imgur.com	True	d7vrww	https://external-preview.redd.it/dm5sHz3CZBC6Hu6KD7ee05q3OJLe7oBKRWvqK0FgWJk.jpg?width=320&crop=smart&auto=webp&s=a3318d751162ec3a2941d2f44a57f7ef497ec8bd		1.0	9	mildlyinteresting	Lucy's shadow looks somewhat like Yoda's head shape.	0.7	1	0	0
ecargoib	a cafe uses small kettles as door handles	1562016144.0	i.redd.it	True	c80cj2	https://preview.redd.it/paur0fxfer731.jpg?width=320&crop=smart&auto=webp&s=355666b50afe9e58fcd24c785f3367b13da9102e		2.0	15	mildlyinteresting	A cafe uses small kettles as door handles	0.88	1	0	0
luxpsycho	this chair in a brazilian nature reserve that prides itself on being virgin material rather than recycled	1550962226.0	i.imgur.com	True	au16uv	https://external-preview.redd.it/VY1eKVfv3BW6iYJNpCb3LmnPTQ-kbO0j_a-W6QtBblY.jpg?width=320&crop=smart&auto=webp&s=8ca7b1a878dd214f7e844afdb145e9b8d44dc0a5		2.0	8	mildlyinteresting	This chair in a Brazilian nature reserve that prides itself on being 100% 'virgin' material (rather than '100% recycled')	0.9	1	0	0
raskulous	an awesome view of paris	1431988671.0	i.imgur.com	True	36f7po	https://external-preview.redd.it/Glwp-mqq2XJ4XpY7CobdkyKRS-ylGpQ_Hp5OEU9MjYo.jpg?width=320&crop=smart&auto=webp&s=67cc0ac6977bb1e2fef5c7f1aea877310e9287bf		1.0	4	photoshopbattles	PsBattle: An awesome view of Paris.	0.83	1	0	0
pper_lord	this face makeup imprint	1566146913.0	i.redd.it	True	cs3mkj	https://preview.redd.it/ijdxz7ecl8h31.jpg?width=320&crop=smart&auto=webp&s=9b8745b74e476efd7caadcd5505c1d89ee2b327b		10.0	57	photoshopbattles	PsBattle: This face makeup imprint	0.92	1	0	0
	dispatcher tells caller deal with it yourself	1438111619.0	news.yahoo.com	True	3exp58	https://external-preview.redd.it/TpYwgZl_YAu-BVWDwCP4lSt8o3uqYqsdOLy4qm3_zjw.jpg?width=320&crop=smart&auto=webp&s=9c5b27e1b5a4374f226391f2feb2270404ee1b12		1.0	6	nottheonion	Dispatcher tells 911 caller, 'deal with it yourself	0.75	1	0	0
jstkpswmmng	heroic driver sacrifices his tesla to save unconscious man in runaway volkswagen	1487188552.0	jalopnik.com	True	5u9twc	https://external-preview.redd.it/y7YCShzAJZL3-Xb28R7JJ3sSVcQ5p9JhR3cUDU5zYM4.jpg?width=320&crop=smart&auto=webp&s=53888d4d00991468533cf70cf0b51c880cd74336		2.0	16	upliftingnews	Heroic Driver Sacrifices His Tesla To Save Unconscious Man In Runaway Volkswagen	0.86	1	0	0
	denver bakery investigated for refusing to write antigay messages on cake	1421931588.0	natmonitor.com	True	2ta8rs	https://external-preview.redd.it/oZdxxqj2oA4Fn5mBZKJslG2sONPWdsMbQpgkR4pAC7Q.jpg?width=320&crop=smart&auto=webp&s=6fade751487507bb8c94023e6f4e7921bf895dbd		34.0	38	nottheonion	Denver bakery investigated for refusing to write anti-gay messages on cake	0.87	1	0	0
Cullen_Murphy	i got some crust on my uncrustable	1562598221.0	i.redd.it	True	cam5wu	https://preview.redd.it/zhixbtb9h3931.jpg?width=320&crop=smart&auto=webp&s=0fa19b55004fc7feb4f3dad60ed94084f4c57272		11.0	6	mildlyinteresting	I got some crust on my Uncrustable	0.72	1	0	0
flappytowel	whitehaven beach	1443098769.0	i.imgur.com	True	3m6ykx	https://external-preview.redd.it/EK9qWVcM-2tIwqq7O78oJYDr5CMAKjyRY9oAb10NIs0.jpg?width=320&crop=smart&auto=webp&s=6cff72a036f654bf4075123f1c576a362d1f0b65		1.0	3	pic	Whitehaven Beach | Australia	1.0	1	0	0
lux514	trump wants to steer un climate cash to building coal plants bloomberg	1500146279.0	bloomberg.com	True	6nhrgc	https://external-preview.redd.it/JPc4kX-5TN3xvnV_EWd2E0UspgVw6e6Jc8-IMWiUonA.jpg?width=320&crop=smart&auto=webp&s=266523f3fbdb5158e94b9e330d87250c4fe22d18		4.0	2	neutralnews	Trump Wants to Steer UN Climate Cash to Building Coal Plants - Bloomberg	0.63	1	0	0
waterfromthesun	dog trying to get ball	1423812457.0	i.imgur.com	True	2vqur0	https://external-preview.redd.it/bTPK6ytYqWnNefOKbBX9M5-O05uUO33NTEEZoMOr0jA.jpg?width=320&crop=smart&auto=webp&s=c8331b9fc643938be09e44cd1562440c97f5b73e		1.0	3	photoshopbattles	PsBattle: dog trying to get ball	0.8	1	0	0
ProfEmory	this benchbin combo in falmouth which looks like bold and brash and belongs in the trash	1570986394.0	i.redd.it	True	dhd9uz			1.0	5	mildlyinteresting	This bench/bin combo in Falmouth, which looks like Bold and Brash (and belongs in the trash).	0.73	1	0	0
samjamtimtam	a woman tracked down the sheikh who saved her grandfather and gave him a home	1497897447.0	bbc.com	True	6i8ds0	https://external-preview.redd.it/fDqMvrlKl2GW6xaD5Wq5NEH_IrqOxW_lV3pF6njTAbo.jpg?width=320&crop=smart&auto=webp&s=ab7d3383e6ba1b2b9f56caae871c3317fac9485d		6.0	24	upliftingnews	A woman tracked down the sheikh who saved her grandfather and gave him a home	0.91	1	0	0
SFepicure	supreme court to hear nc gerrymandering case will smoking gun admission matter	1553406413.0	wfae.org	True	b4t18v	https://external-preview.redd.it/UH4FVBB6aWQvEG4dpT2T8Qi3St3hS9Esc1ZMv80A6vo.jpg?width=320&crop=smart&auto=webp&s=41f02e4c5d38449359ba7d15ace7112db26956eb		2.0	200	neutralnews	Supreme Court To Hear NC Gerrymandering Case. Will 'Smoking Gun' Admission Matter?	0.96	1	0	0
