author	clean_title	created_utc	domain	hasImage	id	image_url	linked_submission_id	num_comments	score	subreddit	title	upvote_ratio	2_way_label	3_way_label	6_way_label
mandal0re	bro thor	1563375493.0		True	eu1u4mv	https://i.imgur.com/Ril5M1n.jpg	cec3nc		352	psbattle_artwork	Bro Thor		0	2	4
bar19255	i call him johnny hes smiling	1569448771.0	i.redd.it	True	d9a8m4	https://preview.redd.it/aiesprcgbto31.jpg?width=320&crop=smart&auto=webp&s=3c583db9e3224bebf09d16c90759b839437183c5		6.0	15	pareidolia	I call him Johnny, he’s smiling!	0.85	0	2	2
theavocadoparadox	neatly arranged sushi	1535906372.0	i.redd.it	True	9cdfbz	https://preview.redd.it/21k6ffmxotj11.jpg?width=320&crop=smart&auto=webp&s=d75daf03f6b2d403e8ea94d3227cf169db9f610b		1.0	7	misleadingthumbnails	Neatly arranged sushi	0.74	0	2	2
Dinokknd	he has sinned and for that he shall pay	1351523526.0		True	c6tdih6	http://i.imgur.com/gmZQi.jpg	129sw3		341	psbattle_artwork	He has sinned, and for that, he shall pay!		0	2	4
FloridaMan_SS	florida man arrested after accusing her of cheating on him in face for making fun of her	1469782689.0	miamiherald.com	True	4v5pjg	https://external-preview.redd.it/W91shc8-R9yGLXifogr9CXPWAVE2l0sdwWpwDdOi3oE.jpg?width=320&crop=smart&auto=webp&s=46dd89c29c6991628bcc91524ba75216e0e5092d		20.0	20	subredditsimulator	Florida Man arrested after accusing her of cheating on him in face for making fun of her	0.92	0	2	3
dinodares99	taking the pulse of a birch tree	1488789765.0	i.redd.it	True	5xs86i	https://preview.redd.it/q7mms1l3lpjy.jpg?width=320&crop=smart&auto=webp&s=131bf5592b4881ec6c14a25ab43551954303b350		0.0	7	misleadingthumbnails	Taking the pulse of a birch tree	0.88	0	2	2
nodnodwinkwink	this jewelery is shocked at the discount from a groupon ad	1392720441.0	i.imgur.com	True	1y8dch	https://external-preview.redd.it/-7gZQytVFks44iGKLHpWLjKoJRxXYr-Cz96cvr_TyZM.jpg?width=320&crop=smart&auto=webp&s=f37965c528555f7a49bce4600ab9a16583324975		0.0	122	pareidolia	This jewelery is shocked at the discount (From a groupon ad)	0.94	0	2	2
BonoboMama	safety first	1465265093.0	imgur.com	True	4mwpt1	https://external-preview.redd.it/q3GDJFW9mOStBluYgfrRQy9hue7TgZdHCuFelWmL8nY.jpg?width=320&crop=smart&auto=webp&s=fb7cda638388211460727270f666a2badcc46fb6		0.0	5	pareidolia	Safety first :)	0.73	0	2	2
AndersonOllie	as a planet	1366729073.0		True	c9kyplx	http://i.imgur.com/LsMfnjv.jpg	1cw00k		3	psbattle_artwork	As a planet		0	2	4
RandiHEhehe	band of blowers	1500133793.0		True	dk99y7q	http://imgur.com/0dPoZpY.jpg	6nfbtk		486	psbattle_artwork	Band of Blowers		0	2	4
Galoreous	crucifixion of jesus ad	1522471956.0	i.redd.it	True	88ghqb	https://preview.redd.it/2napcj4551p01.jpg?width=320&crop=smart&auto=webp&s=5d69722606cb241440235db5dc676cd66fbceed6		0.0	3	fakehistoryporn	Crucifixion of Jesus - 33 AD	0.72	0	2	2
Boompje	one of these days jerry	1388702493.0		True	ceftc42	http://i.imgur.com/vtqzaDm.jpg	1u92wt		4	psbattle_artwork	One of these days, Jerry...		0	2	4
	hey listen	1344572813.0		True	c5qwcrk	http://i.imgur.com/1lpsI.jpg	xyqs0		16	psbattle_artwork	Hey, listen!		0	2	4
BlackJesus36	the civil war circa	1571098030.0	i.redd.it	True	dhzksg	https://preview.redd.it/zjn6ssc6mis31.jpg?width=320&crop=smart&auto=webp&s=893a1835232f70121f416c7578889ec24d8456af		1.0	45	fakehistoryporn	The Civil War (circa 1860)	0.97	0	2	2
mickeybuilds	white people crazy	1416778346.0		True	cmaypja	http://i.imgur.com/q5DBFS4.jpg	2n6ilk		68	psbattle_artwork	White people crazy		0	2	4
jlevnhv	theres even more evidence that one type of exercise is the closest thing to a miracle drug that we have	1504702943.0	archive.is	True	6yfh77	https://external-preview.redd.it/Bc7pjClRBKE1CKmhBTZk3pEzokjc_ff-Tb-eUCJozJE.jpg?width=320&crop=smart&auto=webp&s=cb27ab22182b4c473e47b8d870354d79e8b8e8bb		2.0	59	savedyouaclick	There's even more evidence that one type of exercise is the closest thing to a miracle drug that we have | It's literally any aerobic exercise	0.94	0	2	5
commieflirt	hemisferio occidental postcard depicting the monroe doctrine and relations between the us and latin america	1464134230.0	i.imgur.com	True	4kwv3f	https://external-preview.redd.it/qQN_OTrrWzjcjOjpd2HwHYF6-VKwn7IRZanvksULVnE.jpg?width=320&crop=smart&auto=webp&s=0d7dea2d8d5528e5458fd1c3e80d9a1277666181		21.0	439	propagandaposters	"""Hemisferio occidental,"" 1941 postcard depicting the Monroe Doctrine and relations between the U.S. and Latin America"	0.98	0	1	5
intelminer	an american soldier prepares to charge a viet cong position	1563035265.0	i.redd.it	True	ccr85m	https://preview.redd.it/camlvewsk3a31.png?width=320&crop=smart&auto=webp&s=15313d4faba39ab9ebfcb98260c7f31643cd8bb7		0.0	12	fakehistoryporn	An American soldier prepares to charge a Viet Cong position (1967, Colorized)	0.81	0	2	2
worthy_sloth	my mac loves when i download new apps	1553620675.0	i.redd.it	True	b5sfut	https://preview.redd.it/rms1r5oeyho21.jpg?width=320&crop=smart&auto=webp&s=7993df7e195b541f375b6114002c28e6c50d4b9d		1.0	6	pareidolia	My mac loves when I download new apps!	1.0	0	2	2
jiminyrizzles	stranger things promo	1526046315.0		True	dyt5lwm	https://i.imgur.com/7k9ROeE.jpg	8hfg50		3	psbattle_artwork	Stranger Things Promo		0	2	4
Gargo51	this car eating a taco	1561118622.0	i.redd.it	True	c39q6k	https://preview.redd.it/02e420in9p531.jpg?width=320&crop=smart&auto=webp&s=708b4e41198c4b386b685de41d4bb54d6a86b2a1		0.0	6	pareidolia	This car eating a taco	0.72	0	2	2
phaily	oh you	1372310656.0	i.imgur.com	True	1h5tll	https://external-preview.redd.it/_unWWaUPFSB54YsGgR7Ang0m-KGzkPmL_nf14xfbk0s.jpg?width=320&crop=smart&auto=webp&s=93a0610d4138a4b4a0b5e3af9c671b281d3b4dc4		0.0	29	pareidolia	Oh you	0.88	0	2	2
RebelWookiee	help	1499638360.0		True	dk02ipk	http://i.imgur.com/fMuXSB6.jpg	6m8mob		9	psbattle_artwork	Help!!		0	2	4
thatmattkid58	left hanging	1457034610.0		True	d0mejq2	http://i.imgur.com/uHM9pf6.jpg	48tnoa		1	psbattle_artwork	Left Hanging...		0	2	4
miserable_failure	classic face swap	1417826814.0		True	cmmijir	http://i.imgur.com/0JfZrtf.jpg	2odq1w		21	psbattle_artwork	Classic face swap		0	2	4
thanatos703	afghanistan	1486061116.0		True	dd8vdrw	http://i.imgur.com/VssDzkz.jpg	5rhctr		1	psbattle_artwork	Afghanistan		0	2	4
Silveeto	individually wrapped hamburger patties	1528244158.0	i.redd.it	True	8ow12n	https://preview.redd.it/4p4dwokzw9211.jpg?width=320&crop=smart&auto=webp&s=cffe076257b60121a516b4ccfa8106858e28054c		11.0	593	misleadingthumbnails	Individually wrapped hamburger patties	0.97	0	2	2
Chudge	insides	1469770631.0		True	d5vjv57	http://i.imgur.com/DiXhjiT.jpg	4v4kor		4	psbattle_artwork	Insides		0	2	4
nobody2u	true horror	1434144550.0		True	cs4o591	http://i.imgur.com/vMs5vLx.jpg	39hxgt		2	psbattle_artwork	True Horror		0	2	4
JerenVids	needs more the rock	1428085554.0		True	cq06yhf	http://i.imgur.com/KWy2qFl.jpg	31anmi		3	psbattle_artwork	Needs more The Rock		0	2	4
theblurryboy	the same street years later after almost a decade of war	1520230480.0	i.redd.it	True	823x1x	https://preview.redd.it/20wm0nt70wj01.jpg?width=320&crop=smart&auto=webp&s=053a101f0f5445ce38185e5aed0c4c915c99ff62		0.0	13	fakehistoryporn	The same street, years later after almost a decade of war (2017)	0.91	0	2	2
chefinite	this penguin that stole cyclops visor	1526833772.0	i.redd.it	True	8ktoey	https://preview.redd.it/esyg26o6f1z01.jpg?width=320&crop=smart&auto=webp&s=fab2d549b6e797f3243dd1ef7e9fe2c9b75cd5a0		1.0	2	pareidolia	This penguin that stole Cyclop's visor.	0.76	0	2	2
slopeclimber	of the criminal acts in the country are happening under the influence of alcohol bulgaria mids	1525360802.0	i.redd.it	True	8gr5fm	https://preview.redd.it/juh8u1d9rnv01.jpg?width=320&crop=smart&auto=webp&s=0f66875fd84002113ed63ad55392b1ca45bf3321		9.0	564	propagandaposters	"""30% of the criminal acts in the country are happening under the influence of alcohol"" Bulgaria, mid-1980s."	0.99	0	1	5
iam4real	screaming skull	1505539825.0	i.imgur.com	True	70f8na	https://external-preview.redd.it/uvsOXjFaWHeP3iCTUO5Cv7dfqzS7JevJfhfatdm529Q.jpg?width=320&crop=smart&auto=webp&s=3fc19bbf7bcbda31e3d661b00141e6e16b089b40		0.0	15	misleadingthumbnails	Screaming Skull	0.72	0	2	2
all-top-today_SS	the guy im dating leveled up yesterday and i got bored waiting for his bus this morning picked up by tsmdaequan	1532656698.0	youtube.com	True	928g1u	https://external-preview.redd.it/5nvW9AbvpxdErqLYklt0Dn-EBQfBWnvdglnyxRi0CW4.jpg?width=320&crop=smart&auto=webp&s=54dcd6583275deb46ba2d7c500ff55135d1ab084		21.0	6	subredditsimulator	The guy I’m dating leveled up yesterday and I got bored waiting for his bus this morning picked up by TSM_Daequan	0.81	0	2	3
gnarwalbacon	conga line this way	1373646080.0		True	cb18rb6	http://i.imgur.com/SzLX4BE.jpg	1i5ncn		1119	psbattle_artwork	Conga line this way!		0	2	4
lumm0x	all he can eat	1409681951.0		True	ck79psq	http://i.imgur.com/OBezefK.jpg	2f8zj3		17	psbattle_artwork	All he can eat.		0	2	4
Maverick32183	ellen decruise	1433527972.0		True	crwp9fe	http://vignette1.wikia.nocookie.net/epicrapbattlesofhistory/images/f/fd/Ellendegeneresbasedonpic.jpg	38gf44		19	psbattle_artwork	Ellen DeCruise!		0	2	4
derick1908	new delicacy	1383207174.0		True	cd3l5rq	http://i.imgur.com/Mp9lFMW.jpg	1pk77z		10	psbattle_artwork	New delicacy?		0	2	4
Face_Bacon	going through some old posts on rwoodworking and you run into potus	1494556868.0	i.imgur.com	True	6aorfw	https://external-preview.redd.it/GttyDy85hUgF--ZBU0CVeoyrJ1CEdMpfCJRbrtQwWJ4.jpg?width=320&crop=smart&auto=webp&s=a4822b630590b39e7d5e9908796ac020528bc035		1.0	46	pareidolia	Going through some old posts on r/woodworking and you run into POTUS	0.89	0	2	2
ProDexorite	but this fella means business	1559405435.0		True	epqghmr	https://i.imgur.com/JyrB2aH.jpg	bvgssz		6	psbattle_artwork	but this fella means business!		0	2	4
NewZekelandTravels	heroes in the half shell turtle power	1510716688.0	i.imgur.com	True	7d1bgr	https://external-preview.redd.it/DCHCUtUyPAYAyYn0bWfelqo39tT1t39hDJkvgcw9ecw.jpg?width=320&crop=smart&auto=webp&s=eb93ffc6172d6fcce18dd979bb2b41b7fbefb961		0.0	12	pareidolia	Heroes in the half shell, turtle power!	0.76	0	2	2
kingslothicles	stalin learning of his betrayal by hitler	1563430861.0	i.redd.it	True	ceora3	https://preview.redd.it/yqx6eol490b31.jpg?width=320&crop=smart&auto=webp&s=197a26355ca125dc2663d8ed1339c0a2f39850ab		1.0	34	fakehistoryporn	Stalin learning of his betrayal by Hitler (1941, Colorized)	0.87	0	2	2
_AI_	i tried my best here you go	1431364737.0		True	cr5o38m	http://i.imgur.com/iMmrqOM.jpg	35kz1r		42	psbattle_artwork	I tried my best! Here you go :) 		0	2	4
LasiusAlienus	health experts recommend standing up at desk leaving office never coming back	1424410697.0	theonion.com	True	2wiq7e	https://external-preview.redd.it/HQ480wLVSKhcTfBfvuPnb0HPoAChv394g4x3uV8SvVc.jpg?width=320&crop=smart&auto=webp&s=f5dce29805810c7f43df19184eb606797f5a0b4a		2.0	9	satire	Health Experts Recommend Standing Up At Desk, Leaving Office, Never Coming Back	0.85	0	2	1
soggypoutine	a tapeworm under a microscope	1518613071.0	i.redd.it	True	7xhstj	https://preview.redd.it/l66itcste6g01.jpg?width=320&crop=smart&auto=webp&s=beadfa052422319948cf41775d0f37513ae4729e		12.0	700	misleadingthumbnails	A Tapeworm under a microscope	0.97	0	2	2
PSBBot	available here	1553055736.0		True	eixpws7	https://i.redd.it/89pfnstha7n21.jpg	b37jde		1	psbattle_artwork	available here		0	2	4
charlievictorromeo	sometimes i swear its a ship	1438611964.0		True	ctpwj3o	http://i.imgur.com/lC9741M.jpg	3fm3d9		5	psbattle_artwork	Sometimes I swear it's a ship		0	2	4
turbulenttimbits	nice white alan self titled	1519573978.0	imgur.com	True	8058oa	https://external-preview.redd.it/Nk3fwV16ZvjKQ6XELhgpIDVkIapxyncrGA9VmtBm1iQ.jpg?width=320&crop=smart&auto=webp&s=bfcb040cab6efdbebdc5785044cc19406a5d2d31		1.0	52	fakealbumcovers	Nice White Alan - self titled	0.94	0	2	1
greaterade	king of getting popped	1408512945.0		True	cjvbelb	http://i.imgur.com/HxajEQ2.jpg	2e1lr9		256	psbattle_artwork	King of Getting Popped		0	2	4
artunitinc	oh	1485787903.0		True	dd3l3zf	http://i.imgur.com/zfxsat0.jpg	5r0mvf		1952	psbattle_artwork	Oh...		0	2	4
WinstonCup426	dad abandons girl on dirt road then looks in the rearview mirror and sees her transform	1488574374.0	web.archive.org	True	5xcxws	https://external-preview.redd.it/UwZlqW0ui-pihPkaEIVaq3nh_gGAcOYt6BHNq90R8UU.jpg?width=320&crop=smart&auto=webp&s=fa25eb30f08c906c2d913e42ab24dd97a92dcf44		5.0	93	savedyouaclick	Dad Abandons Girl On Dirt Road, Then Looks In The Rearview Mirror And Sees Her Transform | She's a dog. The video's a PSA about why you shouldn't abandon your dog.	0.96	0	2	5
all-top-today_SS	the democrats greatest fear hold my beer while i seduce you with a pole dance	1521093496.0	youtu.be	True	84k9u5	https://external-preview.redd.it/_qC52OraBlNQS6ctZHhxyJSiVgNnVjTxIsu5we5_2j8.jpg?width=320&crop=smart&auto=webp&s=959771e769ab79dd08a02e65c3f981d6e900dfdb		20.0	55	subredditsimulator	👪 The Democrats' Greatest Fear 👪. Hold my beer while I seduce you with a pole dance	0.98	0	2	3
Lemonette	guess which one the girls like better	1350126842.0		True	c6ltm1l	http://i.imgur.com/iS42H.jpg	11d5zr		8	psbattle_artwork	Guess which one the girls like better!		0	2	4
Awwducational_SS	saigas form very large nests sometimes up to seven million today	1526608688.0	i.imgur.com	True	8k9nnx	https://external-preview.redd.it/B5liuT-1Vyf2ngO832goyIqMOCEd2j8G4aj-4PU6Oj8.jpg?width=216&crop=smart&auto=webp&s=a7c015efe59e9629926ff8c2a5c765bae48abdeb		21.0	7	subredditsimulator	Saigas form very large nests (sometimes up to seven million today	0.83	0	2	3
segasaturns	offoff campus outsider	1481089069.0	i.reddituploads.com	True	5gy77u	https://external-preview.redd.it/xt7kl2waC9PKQ31nbLIEWSbiJMcLYedz5VPKpkR24_s.jpg?width=320&crop=smart&auto=webp&s=9e9926e06d077ac119466102b40765595bdecb75		0.0	11	fakealbumcovers	Off-Off Campus - Outsider	0.92	0	2	1
ApiContraption	cutouts	1398465615.0		True	ch24jvn	http://i.imgur.com/JGwl0ud%2ejpg	23zmks		2	psbattle_artwork	cutouts		0	2	4
Dragonemporer229	nazi rally circa	1532725839.0	i.redd.it	True	92ger6	https://preview.redd.it/09zkohqb3kc11.jpg?width=320&crop=smart&auto=webp&s=be3ecf327594b3ba315de192fbaee53730907408		2.0	22	fakehistoryporn	Nazi rally, circa 1936 [colorized]	0.93	0	2	2
Bob_m_black	a successful potawatomi rain dance c	1517070411.0	i.imgur.com	True	7tdnit	https://external-preview.redd.it/9EhOAEmULMQ4Qc5cwSLr5IolxSvDr3bgGcypKUKkzSE.gif?width=320&crop=smart&format=png8&s=fe1fcb4ef80dbd2375c993d7f3e715955006def8		0.0	66	fakehistoryporn	A successful Potawatomi rain dance (c.1920 colorized)	0.97	0	2	2
rhodium14	its good st man	1419271938.0		True	cn2dqal	http://i.imgur.com/D2wxSKN.jpg	2q2dim		11	psbattle_artwork	It's Good S#!t Man 		0	2	4
theskabus	and thus a reaction face was born	1357755741.0		True	c7tx7ra	http://imgur.com/sGSfD.jpg	169anw		534	psbattle_artwork	And thus a reaction face was born.		0	2	4
Antelope46	blow past the police	1353361383.0		True	c73vbyd	http://i.imgur.com/XwYKV.jpg	13e8ej		2	psbattle_artwork	Blow past the police		0	2	4
staffell	you must be this tall to ride	1443459516.0		True	cvh1ohh	http://i.imgur.com/MzTYjET.jpg	3mlq0c		44	psbattle_artwork	You must be this tall to ride		0	2	4
kmccallsdsu	crank that kawhi	1402533076.0		True	ci59vcc	http://i.imgur.com/3XbpoZy.jpg	27vja9		13	psbattle_artwork	Crank That Kawhi!		0	2	4
TheUnknownStitcher	white southerners participate in a public lynching in rural america	1554742615.0	i.imgur.com	True	baw7uj	https://external-preview.redd.it/8UaEUVcqkw4l3omAeon9hUomNImRaR9Ti9S5jYfDHSo.jpg?width=320&crop=smart&auto=webp&s=d300e2d5408e88740eab97ed3d4e1df02858c3a5		0.0	19	fakehistoryporn	White southerners participate in a public lynching in rural America (1901 - Colorized)	0.89	0	2	2
SofaAssassin	duvets the stuff of nightmares	1532209401.0	i.redd.it	True	90ssjx	https://preview.redd.it/4wgdlqoofdb11.jpg?width=320&crop=smart&auto=webp&s=abf58192e86ab7c6aa14c73b7d5ff0738d6ef904		0.0	6	pareidolia	Duvets, the stuff of nightmares	1.0	0	2	2
BigMurph26	his reaction when he visited asian festival in columbus oh	1378593780.0		True	cc3so0g	http://i.imgur.com/3ZmhpDJ.jpg	1lwy7c		192	psbattle_artwork	His reaction when he visited Asian Festival 2013 in Columbus, OH.		0	2	4
thetruehank	i am reasonably sure no one will notice him	1366174774.0		True	c9gtkcd	http://i.imgur.com/hERJpd6.jpg	1chs2a		703	psbattle_artwork	I am reasonably sure no one will notice him		0	2	4
Langille	everyone wants to suck on the crazy straw	1438263435.0		True	ctlhxje	http://i.imgur.com/D1LiIwm.jpg	3f3hk3		5	psbattle_artwork	Everyone wants to suck on the crazy straw!		0	2	4
VisualShock1991	reminds me of my wife when i crack a hilarious joke	1536476881.0	imgur.com	True	9eb7q9	https://external-preview.redd.it/WcqI82XA9odEKtegGhcoWujp3YyQIrF5r4HgTXm8uP8.jpg?width=320&crop=smart&auto=webp&s=a1538e1a25b9e1de8406c1373735ef86e61fd50b		0.0	2	pareidolia	Reminds me of my wife when I crack a hilarious joke.	0.76	0	2	2
Yare_Daze	machinery of elation zimbabwe nights rac	1523396540.0	i.redd.it	True	8bbp1y	https://preview.redd.it/6egpr7r0e5r01.png?width=320&crop=smart&auto=webp&s=138442b90da059a2debe8b6667a46fb0dd89389a		0.0	2	fakealbumcovers	Machinery of Elation - Zimbabwe Nights [RAC]	1.0	0	2	1
graphleek	i find your lack of food disturbing	1440083961.0		True	cu9jip3	http://i.imgur.com/xPUe7FH.jpg	3hpcvq		9	psbattle_artwork	I find your lack of food disturbing		0	2	4
amirzulkifle	brokeback mountain	1524648744.0	i.redd.it	True	8es9df	https://preview.redd.it/fwdgcfezx0u01.jpg?width=320&crop=smart&auto=webp&s=721265d689897f0894900874cc6378fe4a98fb82		4.0	161	fakehistoryporn	Brokeback Mountain (2005, colourised)	0.97	0	2	2
gravijaxin	no one with bush and clinton	1439498817.0		True	cu20muu	http://i.imgur.com/Czwteef.jpg	3gqvs6		1	psbattle_artwork	No one with Bush and Clinton		0	2	4
_theRealSlimShady	the truth is noble	1421479766.0	i.imgur.com	True	2spswb	https://external-preview.redd.it/8itXHShdeQ1sQMtZS0x_ehOAA9gcGhJnFnA4DYXsYuY.jpg?width=320&crop=smart&auto=webp&s=1424113ffc360c7433c72217296865ca4644df38		0.0	3	fakealbumcovers	The Truth is Noble	1.0	0	2	1
	i have no mouth but i must scream	1437590762.0	imgur.com	True	3e89ch	https://external-preview.redd.it/kEbJ2bJWG76Kez84Zy2GUP203hsNbjQbF_Zklg2db1o.jpg?width=320&crop=smart&auto=webp&s=3fd2b7e2a5134155864156554a863cb1e5855703		0.0	4	pareidolia	I Have No Mouth, but I Must Scream	0.83	0	2	2
westbee	nice hairdo	1487031599.0		True	ddplbig	http://i.imgur.com/mBtMXbh.jpg	5trh6e		3	psbattle_artwork	Nice Hairdo!		0	2	4
Raja-II	haunting image taken within an irish abortion clinic the day of its opening colorised	1529247310.0	i.redd.it	True	8rrjdl	https://preview.redd.it/f4eujuivrk411.jpg?width=320&crop=smart&auto=webp&s=8d34c72e4e0509a8405edbba53ec7f571a4c2a7c		0.0	36	fakehistoryporn	Haunting image taken within an Irish abortion clinic the day of its opening (June 2018, colorised)	0.83	0	2	2
plamda505	union army recruitment poster	1520608064.0	i.redd.it	True	837bqv	https://preview.redd.it/mmmh5vmliok01.jpg?width=320&crop=smart&auto=webp&s=2548402107a29f3d62617370b94da623a7655d3e		0.0	9	propagandaposters	1863 Union Army Recruitment Poster.	0.6	0	1	5
liucifer	legs legs legs	1375765370.0		True	cbhvbqg	http://i.imgur.com/Qjo05nD.jpg	1jpk3u		2	psbattle_artwork	Legs, legs, legs!		0	2	4
CancersMyMiddleName	spiderweb or the grim reaper	1531148305.0	i.redd.it	True	8xce25	https://preview.redd.it/ttyrh9kisx811.jpg?width=320&crop=smart&auto=webp&s=858eb3640f35bee248839c86bc885dfb179ba4f8		2.0	51	pareidolia	Spiderweb, or the grim reaper?	0.9	0	2	2
TheendisNye18	my washing machine and seen some stuff	1484270027.0	i.reddituploads.com	True	5nngy0	https://external-preview.redd.it/uyjuiMGplt7-sAg_ohtuYjMmqwA3vxqqe0O0CpLzj4U.jpg?width=320&crop=smart&auto=webp&s=20f585b1d1ef69432da6a7379d7751c016f35564		0.0	6	pareidolia	My washing machine and seen some stuff	0.99	0	2	2
Slamchops	such a smooth criminal	1407214337.0		True	cjha11d	http://i.imgur.com/1ntT8je.jpg	2cniqy		15	psbattle_artwork	Such a smooth criminal		0	2	4
JaegerBurn	air nelson cruelty	1476534109.0	i.redd.it	True	57ltgo	https://preview.redd.it/wqyomd1csmrx.jpg?width=320&crop=smart&auto=webp&s=abf5db979e69d6d1c7f78c4994a59f8fb3fd9fc5		1.0	5	fakealbumcovers	Air Nelson - Cruelty	1.0	0	2	1
bitterbuffaloheart	recreational marijuana use is legalized in colorado	1524484051.0	i.imgur.com	True	8eau2f	https://external-preview.redd.it/Z5KXrsaZwRqRAu9KC3w-xtZxHOUwsVO-cGLjhdAVrRQ.jpg?width=320&crop=smart&auto=webp&s=8c10f242f312be23b283130cc858678f653dcec5		1.0	30	fakehistoryporn	Recreational marijuana use is legalized in Colorado, 2014	0.98	0	2	2
amaxen	americans tommygun wielding gangsters wwii	1378371048.0	imgur.com	True	1lrv5m	https://external-preview.redd.it/2nshgURZbktYyyZy9NF3ITwzyHWu29beNOtgSMs4KY8.jpg?width=320&crop=smart&auto=webp&s=13471e0f5405ea77bba665f5b6dd07d180ea9dfe		21.0	228	propagandaposters	"""Americans: Tommy-gun wielding gangsters"", WWII, 1944"	0.99	0	1	5
MaeBeWeird	wut	1405287714.0		True	ciwi8sv	http://i.imgur.com/r4kgp3X.jpg	2alzwo		11	psbattle_artwork	Wut?		0	2	4
	this cute little pallet outside my work	1441413324.0	imgur.com	True	3josgj	https://external-preview.redd.it/0gDwwzei4Sg7H68q7UZ2rrxwkc_FqKFMUNZB81LnZks.jpg?width=320&crop=smart&auto=webp&s=72289f5bdf6646d84221d427adacf9df21987b6a		0.0	2	pareidolia	This cute little pallet outside my work	0.67	0	2	2
ApiContraption	cutouts	1410729281.0		True	ckiax6t	http://i.imgur.com/6SH9m1p%2ejpg	2geevo		1	psbattle_artwork	cutouts		0	2	4
ApiContraption	cutouts	1404657811.0		True	cipub2x	http://i.imgur.com/HWcy0Ud%2ejpg	29ywoq		1	psbattle_artwork	cutouts		0	2	4
donutsalad	not amused at all	1358097785.0		True	c7w6r2i	http://i.imgur.com/e0Jjb.jpg	16hwwb		14	psbattle_artwork	Not amused at all		0	2	4
ZugNachPankow	our cause is just the enemy shall be defeated soviet union date unknown	1445888862.0	i.imgur.com	True	3qblg8	https://external-preview.redd.it/uhK9wr0gfPd1DEPyGcTgkpXtS-Tb3im1qBSWTO5rU4w.jpg?width=320&crop=smart&auto=webp&s=91cfa175399ec8409d306ec79e1ad20879d1b73d		11.0	30	propagandaposters	"""Our cause is just / The enemy shall be defeated!"", Soviet Union, date unknown"	0.95	0	1	5
herhusbandhans	fistpump	1501550521.0		True	dkzrabl	http://i.imgur.com/OUe9O9F.jpg	6qry23		89	psbattle_artwork	Fist-pump		0	2	4
PhotoShopist	all warfare is based on deception sun tzu the art of war	1436926938.0		True	ct3pj7d	http://i.imgur.com/EpHK3BI.jpg	3dby9p		2	psbattle_artwork	"“All warfare is based on deception"" ― Sun Tzu, *The Art of War*"		0	2	4
XientCE	the dotted road by journey first attempt so names are crap	1527503314.0	i.redd.it	True	8mp3d1	https://preview.redd.it/gcmkwhcxpk011.png?width=320&crop=smart&auto=webp&s=d0003eea5fb38623a2e67953d4201a0e9321e558		0.0	8	fakealbumcovers	The Dotted Road by Journey (First attempt so names are crap)	0.84	0	2	1
The_Russian_Sniper	new york harbor before the events of	1514756917.0	i.redd.it	True	7nb8pg	https://preview.redd.it/drbc8333wb701.jpg?width=320&crop=smart&auto=webp&s=da2b77b1f8c69f740b93f0eac0ca1a34451805ff		0.0	4	misleadingthumbnails	New York harbor before the events of 9/11	0.59	0	2	2
The-Real-El-Crapo	the oklahoma land rush	1564279092.0	i.redd.it	True	ciq5nr	https://preview.redd.it/dz3a3shcbyc31.jpg?width=320&crop=smart&auto=webp&s=f570c4012684a8ea00c96f0e7a6ac63232b93c79		4.0	7	fakehistoryporn	The Oklahoma land rush (1893)	0.89	0	2	2
MisterNRG	why so serious	1507717371.0	i.redd.it	True	75o5pv	https://preview.redd.it/o3qx63kbg6rz.jpg?width=320&crop=smart&auto=webp&s=17961dc40b3c2337b9cc003960e2752c7b8515a1		6.0	118	pareidolia	Why so serious	0.93	0	2	2
Hawfinch	have the xrays sent to my office i want to sleep on them	1390539511.0		True	cexhqdb	http://i.imgur.com/d9tXLoC.jpg	1vympb		4	psbattle_artwork	Have the x-rays sent to my office. I want to sleep on them.		0	2	4
reidfisher	nasa sends the apollo command module to the moon	1534849984.0	i.redd.it	True	992adp	https://preview.redd.it/cl0x45whjfh11.jpg?width=320&crop=smart&auto=webp&s=3fac991865fd27dd238ca691b959c03d9c6fcdb5		0.0	89	fakehistoryporn	NASA sends the apollo 11 command module to the moon (1969)	1.0	0	2	2
ZogoRanger	this is a boring place	1363969816.0		True	c90h3a4	http://i.imgur.com/JzjgDcp.jpg	1asxmm		11	psbattle_artwork	This is a boring place.		0	2	4
brohontas	fire warrior	1418071512.0	i.imgur.com	True	2oojok	https://external-preview.redd.it/isxcQD3pdQ7WlZpqhiBHm9n_ofsrMbnT0LfExjYfy4Y.jpg?width=216&crop=smart&auto=webp&s=911082e3524360303056b58b212b4946e0b7d167		3.0	3	pareidolia	Fire warrior.	0.72	0	2	2
sunkist_sudefed	effortless this is why	1569233774.0	i.redd.it	True	d84jhr	https://preview.redd.it/2fe9y635kbo31.jpg?width=320&crop=smart&auto=webp&s=3d5aa689b02494a9adb7e6b33224d7b5bf174066		0.0	4	fakealbumcovers	Effortless - This Is Why	0.67	0	2	1
johnnyhammerstixx	scared onion	1386784390.0	i.imgur.com	True	1snc6p	https://external-preview.redd.it/knnTy7Rebucc5vY3jAKsV0qNFleOXdE3fB-Q6QeLROw.jpg?width=320&crop=smart&auto=webp&s=15480bd49759ce9056f5a2487135bc62574db0bd		0.0	5	pareidolia	Scared onion	1.0	0	2	2
Honest_Joseph	spacex falcon heavy successfully launches	1517952173.0	media1.tenor.com	True	7vqql4	https://external-preview.redd.it/JeQ1ss4VmB0eRhHyw8_M1SQUPLLY7Mj45Bu2FrqnMts.gif?width=320&crop=smart&format=png8&s=abfa8a9a7022be5fda2e6b2f29bd1c135f92d083		1.0	29	fakehistoryporn	SpaceX Falcon Heavy successfully launches, 2018	0.95	0	2	2
djtravz	the seahorse on the sidewalk	1505770874.0	i.redd.it	True	70y9a4	https://preview.redd.it/jcqcgq9bopmz.jpg?width=320&crop=smart&auto=webp&s=11383b69f6c121c0387b8608ae1435e8ed49d305		0.0	9	pareidolia	The seahorse on the sidewalk	0.91	0	2	2
	chocolate milk anyone	1395662704.0		True	cgahr1y	http://i.imgur.com/waTEdQg.jpg	217tdr		36	psbattle_artwork	Chocolate milk, anyone?		0	2	4
