author	clean_title	created_utc	domain	hasImage	id	image_url	linked_submission_id	num_comments	score	subreddit	title	upvote_ratio	2_way_label	3_way_label	6_way_label
nottheonion-SS	rex tillerson state department can be blamed for carbon monoxide scare	1512363488.0	detroit.cbslocal.com	True	7hf5kl	https://external-preview.redd.it/Uf40Cv2Sg59DKH4EPzorL3cnTy0UHIrYOSfqaD2s8Rk.jpg?width=320&crop=smart&auto=webp&s=cfdd9c4cbd4df6d520d08be48bc5dc985913231d		22.0	47	subredditsimulator	Rex Tillerson: state department can be blamed for carbon monoxide scare	0.96	0	2	3
michaelconfoy	philanthropic hitler january goebbels is weeping and saying if only the world knew what the fuhrer could give and how deeply he loves the whole of mankind by boris efimovich efimov	1439013707.0	i.imgur.com	True	3g7v9a	https://external-preview.redd.it/zC0MuRYck5sf4Zm3gsGp-AwgvdTaWMvZtMlyOltd76k.jpg?width=320&crop=smart&auto=webp&s=2ec7b35f901ac2528dfdb87259e274a54592da09		30.0	270	propagandaposters	"""“Philanthropic” Hitler"", January 31, 1945, Goebbels is weeping and saying, ""“If only the world knew what the Führer could give and how deeply he loves the whole of mankind.”..."", by Boris Efimovich Efimov."	0.96	0	1	5
JuvenoiaAgent	cpap mask upside down	1567352869.0	i.imgur.com	True	cybjhw	https://external-preview.redd.it/vgP_3WZfOlR3bmSSiO6qKBa58X5SiQBG4fUAgWAVAVk.jpg?width=320&crop=smart&auto=webp&s=9f40c76fa2c0dfa741fce7ee6c88cf4bcd5ead19		1.0	2	pareidolia	CPAP mask upside down	0.75	0	2	2
Brzostek	this chair makes me uncomfortable	1557677889.0	i.redd.it	True	bnqpup	https://preview.redd.it/gxpslqrh2tx21.jpg?width=320&crop=smart&auto=webp&s=937bb9f2134ae0d293496c9316b9d39628bb85b6		2.0	45	pareidolia	This chair makes me uncomfortable.	0.96	0	2	2
Tomulasthepig	imgur	1469314529.0		True	d5o47uj	http://i.imgur.com/crAoix6.jpg	4u7rw5		16	psbattle_artwork	Imgur		0	2	4
tacothecat	yaaayy cheesy poofs	1383248225.0		True	cd3x3r4	http://i.imgur.com/4HEtHZX.jpg	1plz7i		101	psbattle_artwork	YaaAyy Cheesy Poofs!		0	2	4
news_SS	fearless girl is leaving charging bull moving to irvine we will decide who comes into the ground in pittsburgh	1525946290.0	sfgate.com	True	8idpnk	https://external-preview.redd.it/bYuFLH3DW26r0A5fmbSNRwTnmI0d_SsYvDN0TTQbxt0.jpg?width=320&crop=smart&auto=webp&s=eddd3afee514208e006ee73e4d0f17c7c5f31459		40.0	12	subredditsimulator	'Fearless Girl' is leaving 'Charging Bull,' moving to Irvine: 'We will decide who comes into the ground in Pittsburgh	1.0	0	2	3
ApiContraption	other discussions	1387858918.0		True	ce907ld	http://i.imgur.com/K6A9TUE%2ejpg	1tl0pu		1	psbattle_artwork	Other Discussions		0	2	4
tooshiftyfouryou	somanychains work cited	1537330381.0	i.redd.it	True	9h1zm3	https://preview.redd.it/9yp12ztze4n11.jpg?width=320&crop=smart&auto=webp&s=e276bf8399038097b1a36ce1046702620d35d10b		0.0	2	fakealbumcovers	SOMANYCHAINS - Work cited	0.63	0	2	1
ApiContraption	cutouts	1406528139.0		True	cj9szjs	http://i.imgur.com/MfKUCPv%2ejpg	2bx8kx		0	psbattle_artwork	cutouts		0	2	4
weedlol69	i was cleaning up the kitchen and realized this rag looks like a face	1531712287.0	i.imgur.com	True	8z7nsc	https://external-preview.redd.it/hbwfsoZ8WRpVjlPigAR7_6NP3H7efnZ-mjsF1tM3rUo.jpg?width=320&crop=smart&auto=webp&s=123620cf0ef3cc2d7d010736d6877cccda513434		0.0	10	pareidolia	I was cleaning up the kitchen and realized this rag looks like a face :)	1.0	0	2	2
pokemongo_SS	how to evolve one not sure if hes inviting me to swim or just a amazing sight after a month hiatus	1503777500.0	i.redd.it	True	6w7qq5	https://preview.redd.it/cpc4pgkjuohz.jpg?width=320&crop=smart&auto=webp&s=a9302e7e19dcef163e4d78781cc50908980e0ea0		20.0	11	subredditsimulator	How to evolve one, not sure if he's inviting me to swim, or just a amazing sight after a 6 month hiatus!	0.92	0	2	3
davidicusrex	deep fried mice	1526893209.0	i.redd.it	True	8kzf2h	https://preview.redd.it/znfh8y8xb6z01.jpg?width=320&crop=smart&auto=webp&s=0253bb477614a7420d6e4db602c166bf09aeee3d		0.0	29	misleadingthumbnails	deep fried mice	0.97	0	2	2
Iridescent_Meatloaf	whoopsie variations on failure	1506749368.0	i.redd.it	True	73d8yq	https://preview.redd.it/0f7tjkkbhyoz.jpg?width=320&crop=smart&auto=webp&s=0f3fb22f307c761934574893095227943385d8a2		4.0	49	fakealbumcovers	Whoopsie- Variations on Failure	0.88	0	2	1
PittExitreader	found this fine gentleman at work	1435027753.0	imgur.com	True	3asb8x	https://external-preview.redd.it/7yEXXtVrS28tdl5wh0OeeisGKrPdoePsGo55MSvo-e4.jpg?width=320&crop=smart&auto=webp&s=363fff9a7ef4e90df6d30e6e5b0802aa45ad36d8		0.0	5	pareidolia	Found this fine gentleman at work	0.73	0	2	2
MexicanPenguin	dude i think were covered in snow oo	1419713248.0	imgur.com	True	2qk4i5	https://external-preview.redd.it/wkNkFe0-JtfM7_1uL7lw01VyhJCMQgbyRY-NJH6uKGY.jpg?width=320&crop=smart&auto=webp&s=152807f1a6d79a5438bed58f89328e2cbdb6a9fd		2.0	277	pareidolia	Dude, I think we're covered in snow O.O	0.92	0	2	2
ViKomprenas	oo	1483104826.0	i.imgur.com	True	5l3g50	https://external-preview.redd.it/ansUDcF_E2ALPiEbGQYAKBCi1IBwdDokjujVRjjnZGc.jpg?width=320&crop=smart&auto=webp&s=962f0240cd47792642217839708a5e3a15718441		0.0	9	pareidolia	o◾️o	0.63	0	2	2
aalsi_sloth	just another indian festival for vin diesel and jason statham	1437482406.0		True	ctasxh3	http://i.imgur.com/tCy2u9F.jpg	3dgoho		4	psbattle_artwork	Just another Indian festival For Vin Diesel and Jason Statham.		0	2	4
tondabog	gulliver	1500331908.0		True	dkcsl1l	http://i.imgur.com/ElAN9FQ.jpg	6nm8jc		74	psbattle_artwork	Gulliver		0	2	4
KrypLithium	the rising of bernie sanders of	1566942689.0	gfycat.com	True	cwb6p8	https://external-preview.redd.it/wdyS9JraNx6cQuSec5noHA4lyuG3FwjwaPvalL9nXK8.gif?width=320&crop=smart&format=png8&s=9d7ff91931bc431a273d69fd310bd7ebeb1af1c4		2.0	29	fakehistoryporn	The rising of Bernie Sanders, August of 2019.	0.83	0	2	2
defdac	man what a dump	1372875068.0		True	cavbgub	http://i.imgur.com/ALFzbgd.jpg	1hk6md		15	psbattle_artwork	Man. What a dump.		0	2	4
ApiContraption	other discussions	1379640610.0		True	ccbso3m	http://i.imgur.com/bpbUFfl%2ejpg	1mr0qr		1	psbattle_artwork	Other Discussions		0	2	4
MC_Labs15	standing atop an aztec pyramid	1519860202.0	i.imgur.com	True	810nzu	https://external-preview.redd.it/x3TFB-iVaV36eYqxy0vqyZT6jrIayQUbE_Xphz2w4-8.jpg?width=320&crop=smart&auto=webp&s=fc384f98520c42faa44e68a5d614833c1de4ed22		0.0	9	misleadingthumbnails	Standing atop an Aztec pyramid	0.77	0	2	2
Borkin_Bandit	cia attempting to acquire information on bin ladens location circa	1538326611.0	i.redd.it	True	9k7wpn	https://preview.redd.it/i3ag8cxapep11.jpg?width=320&crop=smart&auto=webp&s=98323e21e4087af080679f091abd59d2e392abe7		3.0	79	fakehistoryporn	CIA attempting to acquire information on Bin Laden's location. Circa 2003	0.97	0	2	2
canaan2000	giant cat	1526844493.0	i.redd.it	True	8kuvuk	https://preview.redd.it/xtcn3mkv31z01.jpg?width=320&crop=smart&auto=webp&s=0b399adf807d62ebba684b06cc701265ecbe0f3f		1.0	79	confusing_perspective	Giant Cat	0.99	0	2	2
bizcho	iceberg lettuce	1556997020.0	i.redd.it	True	bkolrs	https://preview.redd.it/rq159tvqt8w21.png?width=320&crop=smart&auto=webp&s=5f64373ec76c14c6d2e1f6e0d7e5d5f01ac816f7		3.0	51	misleadingthumbnails	Iceberg Lettuce	0.92	0	2	2
gopnikaz	motherboard inside a computer	1564243197.0	i.redd.it	True	cij6yc	https://preview.redd.it/hv43cd7mcvc31.jpg?width=320&crop=smart&auto=webp&s=22c8a219f69668f2b7d2ebcce40d4cc5e921b864		38.0	4158	misleadingthumbnails	Motherboard inside a computer	0.98	0	2	2
Gryphonpheonix	when you go crowdsurfing at a baseball game	1517235017.0		True	dtet8dd	https://pre00.deviantart.net/0cd2/th/pre/f/2018/029/9/5/baseball_picture_by_holt5-dc1j7y7.jpg	7trzui		1	psbattle_artwork	When you go crowd-surfing at a baseball game.		0	2	4
all-top-today_SS	this man is a boy	1436803096.0	i.imgur.com	True	3d504v	https://external-preview.redd.it/ylm9NQXds8XqJVRTSh8seZWqYX_K091qtHBsXPsPCxI.gif?width=320&crop=smart&format=png8&s=fdb9158a7e66dee9c328b9fd288a88a77b64f940		21.0	359	subredditsimulator	This man is a boy	0.98	0	2	3
totallynotrobots_SS	be honest who else does this meet acceptable tolerance levels	1556582292.0	i.redd.it	True	biwljk	https://preview.redd.it/d9o2hwssybxy.jpg?width=320&crop=smart&auto=webp&s=e687dd98891173ac3e6a55c0310724c30dde3ddc		20.0	64	subredditsimulator	BE HONEST - WHO ELSE DOES THIS MEET ACCEPTABLE TOLERANCE LEVELS?	0.94	0	2	3
Johnny_Skins	someones got to do it	1438348501.0		True	ctmqeb8	http://i.imgur.com/SP1AF2A.jpg	3f9vmx		2	psbattle_artwork	Someone's got to do it		0	2	4
dankermemes34	tfw your pads get old	1555515011.0	i.imgur.com	True	be95md	https://external-preview.redd.it/P2GUEcX-MEsW02HHUitvIzCZnfEmfixTwqNQWNNqr-M.jpg?width=320&crop=smart&auto=webp&s=16501b2123649da708167a709d2533d923cc651a		0.0	3	pareidolia	tfw your pads get old	1.0	0	2	2
ene_due_rabe	proud of herself	1514922381.0		True	ds3crc3	https://i.imgur.com/k5Le538.jpg	7no2rv		3	psbattle_artwork	Proud of herself...		0	2	4
quimbalicious	hiphiphophiphopanonymous	1416242977.0		True	cm530kp	http://i.imgur.com/9XXCTjE.jpg	2mjr5k		119	psbattle_artwork	Hip...Hip-Hop...Hip-Hop-Anonymous?		0	2	4
anarachelb	someone thought this would be perfect over here im excited to hear everyones ideas	1513619379.0	i.redd.it	True	7kmtjc	https://preview.redd.it/lzz83if0yp401.jpg?width=320&crop=smart&auto=webp&s=1e170b1cbe70c68467a445292bcfc427d56e199d		2.0	18	fakealbumcovers	Someone thought this would be perfect over here. I’m excited to hear everyone’s ideas. :)	0.88	0	2	1
mynameisdom	louisiana town evacuated after million pounds of explosives discovered	1354723392.0	newsfeed.time.com	True	14bs3u	https://external-preview.redd.it/_ozmfuaU9hest8ejQBCK_KdETXOWEo3rm0Crz8BglsI.jpg?width=320&crop=smart&auto=webp&s=836ced9ed698372f4752488c191a56b9c1e7395c		7.0	30	nottheonion	Louisiana Town Evacuated after 6 Million Pounds of Explosives Discovered	0.78	1	0	0
Cardboard95	christiano ronaldo to meet child who lost both parents in beirut bombings	1447980049.0	thesportbible.com	True	3ti8nn	https://external-preview.redd.it/lr07F7LhboTVxoCyExXiWKPODbmu0-Y5RNy_Btvsz9M.jpg?width=320&crop=smart&auto=webp&s=65764d85b0fecd7f55f3203acc3ddf8da86e7a93		4.0	33	upliftingnews	Christiano Ronaldo to meet child who lost both parents in Beirut bombings	0.9	1	0	0
lukalucasluka	qizai the only brown panda in the world	1476727601.0	i.redd.it	True	57ytnj	https://preview.redd.it/jkh0z1iqr2sx.jpg?width=320&crop=smart&auto=webp&s=c0674f8445d4c8a17537c6eb9c4fa0b2274189d6		33.0	1639	photoshopbattles	PsBattle: Qizai, the only brown panda in the world.	0.97	1	0	0
bfwilley	san francisco suspect accused of hate crime in assaults on asian women	1504455494.0	sanfrancisco.cbslocal.com	True	6xu1o8	https://external-preview.redd.it/szJi1N4Ud4ABHk_9Aq5fZ-JKQp8vtKq8qK654AECyPU.jpg?width=320&crop=smart&auto=webp&s=0a958f8b62ee0f52aa53b075e9784a0119dd7646		0.0	10	usanews	San Francisco Suspect Accused Of Hate Crime In Assaults On Asian Women	1.0	1	0	0
freethinker78	state doctors wife mishandled vaccines caused outbreak	1563819527.0	wkyt.com	True	cgguvv	https://external-preview.redd.it/JRFIUMuql9pOJ0kWo_D3FDKms4RFw9X8qS_od0apNAc.jpg?width=320&crop=smart&auto=webp&s=f7396e80bbea68950863d9cdf82e8e16f16ed879		0.0	22	usnews	State: Doctor's wife mishandled vaccines, caused outbreak	0.85	1	0	0
GlowingBall	starbucks apologizes after woman finds satanic symbols in coffee	1396464692.0	wfsb.com	True	2219yk	https://external-preview.redd.it/0U9ZLE9HtR8mWBR7fScPwj_SBy67FLPaCILiyDFUvmc.jpg?width=320&crop=smart&auto=webp&s=c1366293c1a2e6ac1bd5badd2f0f7ca2c36b468c		1.0	4	nottheonion	Starbucks Apologizes After Woman Finds Satanic Symbols in Coffee	0.65	1	0	0
warhorseGR_QC	mt pilatus looking up from lake lucerne switzerland	1463141327.0	i.imgur.com	True	4j60hx	https://external-preview.redd.it/je3n_oh5p9QYZI8ttOphqcvutwPi2_aNC4ZFkJ17ffk.jpg?width=320&crop=smart&auto=webp&s=9dc13bf2d9df5f2645bb4f58a69a2c8b0659022d		11.0	285	pic	Mt. Pilatus, Looking up from Lake Lucerne, Switzerland	0.96	1	0	0
Decathlon44	mlb pitcher traded for	1403147443.0	msn.foxsports.com	True	28iq8l	https://external-preview.redd.it/6i7UqGd0kusgYTk3axYurfn5iO6o1IXnQsGylGR7cDA.jpg?width=320&crop=smart&auto=webp&s=2b064c4183690f0e750e7febdd8625980a407f3a		8.0	8	nottheonion	MLB pitcher traded for $1	0.75	1	0	0
whoisyourhero	this small pennsylvania community embraced its bethlehem steel heritage by renovatingconverting a historic steel mill into a functional school	1562040285.0	myhero.com	True	c84jsc	https://external-preview.redd.it/-vAhsJ6QPjgNH3rt5m7QOmvQgi4GHtJmttIoCfjR3CQ.jpg?width=320&crop=smart&auto=webp&s=f2eed7e4775e4448360a79d5d282258d090df58c		0.0	39	upliftingnews	This small Pennsylvania community embraced it's Bethlehem Steel heritage by renovating/converting a historic steel mill into a functional school.	0.94	1	0	0
neildegrassebyeson	this brewery has old kegs they use as urinals	1535910287.0	i.redd.it	True	9cdyt0	https://preview.redd.it/ed0whibb4vj11.jpg?width=320&crop=smart&auto=webp&s=877758de599e740b50fd58333928dbb4ae88df0a		27.0	243	mildlyinteresting	This brewery has old kegs they use as urinals	0.87	1	0	0
Finn_Kellam	this empty toothbrush holder looks kinda like a robot	1571607065.0	i.redd.it	True	dkq7qs	https://preview.redd.it/frga8k26lrt31.jpg?width=320&crop=smart&auto=webp&s=b0045bf01f5b9b6cc6cdc475bc8c45d30c92cfef		3.0	11	mildlyinteresting	This empty toothbrush holder looks kinda like a robot	0.82	1	0	0
xXCheeseMasterXx	this ski bike i saw at steamboat colorado	1555885951.0	i.redd.it	True	bfujo5	https://preview.redd.it/5hfzht882pt21.jpg?width=320&crop=smart&auto=webp&s=a2a16e35ec4053da0e56c23588163ad35a5ac153		5.0	15	mildlyinteresting	This ski bike I saw at Steamboat, Colorado	0.79	1	0	0
St3amb0t	the soil has washed out from under these old stumps fall creek reservoir or	1567635642.0	i.redd.it	True	czrrwo	https://preview.redd.it/w7nurnl2knk31.jpg?width=320&crop=smart&auto=webp&s=d5997b15b299c7e05f878aa36a710edf266da27b		59.0	1759	mildlyinteresting	The soil has washed out from under these old stumps (Fall Creek Reservoir, OR)	0.98	1	0	0
lianit	sylvester stallone creed movie	1494897147.0	i.imgur.com	True	6begb2	https://external-preview.redd.it/rl9qEDDNmvgLtV58aewa2LExEVqK98duDfAXg5KWUcE.jpg?width=320&crop=smart&auto=webp&s=c868cc2d78a2b7a4ba55535d7c92f6699be9608e		1.0	2	photoshopbattles	PsBattle: Sylvester Stallone Creed Movie	0.75	1	0	0
kamikazeschaf	derping dogs	1361034618.0	i.imgur.com	True	18n6vc	https://external-preview.redd.it/fFLvCnCDcVEiorqiOYy4HyQbWOmpyFl-9MQZszhKHwM.jpg?width=320&crop=smart&auto=webp&s=8544535a05cd7bb83b6d878394ea6e71514836c0		0.0	23	photoshopbattles	Derping dogs (xpost from /r/funny)	0.93	1	0	0
vociferousnoodle	firefighters who fought blaze at grenfell tower to get free holidays	1499108665.0	google.co.in	True	6l1x6q	https://external-preview.redd.it/kVhks8_JEi2ufd9RSYXQF9DJ3Eb52mNodKhHnrJdwkY.jpg?width=320&crop=smart&auto=webp&s=cfa651db5d5c224e49af632aa63e88e3d711a75b		3.0	22	upliftingnews	Firefighters who fought blaze at Grenfell Tower to get free holidays	0.9	1	0	0
JohnnieH	sudan nabs israeli spy vulture	1354838883.0	ynetnews.com	True	14ewtz	https://external-preview.redd.it/GeywrvKFadR1-iWPz5l87TVOSO2sKFpH4y2Z2-GVuhg.jpg?width=108&crop=smart&auto=webp&s=3e78a46b3cdb2a16327b16be1ed2b4e8f6a5b020		1.0	7	nottheonion	Sudan nabs Israeli 'spy' vulture 	0.9	1	0	0
Macsk8er321	corgi puppy midyawn	1496160657.0	i.imgur.com	True	6e8ak6	https://external-preview.redd.it/Z5puK9tQuaSdZ_3QWXGL6wdq6Kuso_cNYjaFF2G7Zqw.jpg?width=320&crop=smart&auto=webp&s=7161dba812a3a2d573176cbaed91809ac546c791		5.0	14	photoshopbattles	PsBattle: Corgi Puppy Mid-Yawn	0.9	1	0	0
chatshitgetbanged24	cesaro uppercutting various wwe superstars	1480899903.0	pbs.twimg.com	True	5giz6u	https://external-preview.redd.it/3DNbafwG6G4Q5b9ne_XSSh3hquVuk0WDmcheWfanoZ0.jpg?width=320&crop=smart&auto=webp&s=6663014107e53ca898763daae09cfba6b8bf9a5a		4.0	61	photoshopbattles	PsBattle: Cesaro uppercutting various WWE superstars	0.85	1	0	0
Rando_Thoughtful	a single tiny cloud was over la while my plane was landing this morning	1557637050.0	imgur.com	True	bnlf69	https://external-preview.redd.it/cbTdeKEw_rusaQvaDIfELmSLMvTEaqW3nQdqdGNsE2o.jpg?width=320&crop=smart&auto=webp&s=63fefa1257147c71d18875a17993ece23c172ee9		8.0	18	mildlyinteresting	A single tiny cloud was over LA while my plane was landing this morning	0.88	1	0	0
lobob123	toucan with severely damaged beak is now getting a dprinted replacement	1423984447.0	aravua.com	True	2vyc4e	https://external-preview.redd.it/dV8i8tc94VWq5wRAyeDawjYqgqYd9B8s7aYeM01ew6U.jpg?width=216&crop=smart&auto=webp&s=69ca7f8964ceddc33330751d22be75a7078827b5		4.0	17	upliftingnews	Toucan with severely damaged beak is now getting a 3D-printed replacement [x-post /r/offbeat]	0.87	1	0	0
SyckTycket	this spray painted tree knot	1531337257.0	i.redd.it	True	8y2lw2	https://preview.redd.it/zd5x0u8ded911.jpg?width=320&crop=smart&auto=webp&s=bcdb99ed74c8be86ff33919fa39fa164b99dc1b1		5.0	10	photoshopbattles	PsBattle: This spray painted tree knot.	0.92	1	0	0
Biteysdad	the way my leg hair is after a bath	1554551799.0	imgur.com	True	ba3kvi	https://external-preview.redd.it/kDNzgFAmX1nSe2OA22w5MGQUr2jcgz8TnG-80yPq0HA.jpg?width=320&crop=smart&auto=webp&s=59b6d740ed5013d79f91c6e8983d7e47e0efef8f		16.0	5	mildlyinteresting	The way my leg hair is after a bath.	0.58	1	0	0
JackleBee	investigation finds claw machines are rigged to steal your money	1441289817.0	abc7chicago.com	True	3jho4l	https://external-preview.redd.it/rixsos0U9qjt-GNP_cIKN3JqRis3GnRpJlZJKyloI68.jpg?width=320&crop=smart&auto=webp&s=5b12ecf2f9d0272f916575a1669bddc555d04e9d		29.0	53	nottheonion	Investigation finds claw machines are rigged to steal your money	0.9	1	0	0
hard_copy	bleach stain on my floor mat looks like the nike logo	1560433215.0	i.redd.it	True	c05y8d	https://preview.redd.it/v5pond4kn4431.jpg?width=320&crop=smart&auto=webp&s=6270027aa16f73f5b4a965b7f7894b7881f540a6		2.0	8	mildlyinteresting	Bleach stain on my floor mat looks like the Nike logo	0.9	1	0	0
ruskeeblue	americas new tobacco crisis the rich stopped smoking the poor didnt	1498105948.0	washingtonpost.com	True	6ir9cj	https://external-preview.redd.it/On1FZv1FCq2PKNS4351oilTHAaX8GCZJ3KOJl8ryXGM.jpg?width=320&crop=smart&auto=webp&s=66eb6c1bdd3c78b6dada610f5fa6bfded71cd8d9		0.0	4	usnews	America’s new tobacco crisis: The rich stopped smoking, the poor didn’t	0.83	1	0	0
texturedpolygon	amusing tip jar sign at sandwich shop	1563717149.0	i.redd.it	True	cfz7bp	https://preview.redd.it/uepi6zaewnb31.jpg?width=320&crop=smart&auto=webp&s=bf9dba3e5f23c591d4889ab196bc92c8cccc7526		2.0	11	mildlyinteresting	Amusing tip jar sign at sandwich shop	0.79	1	0	0
DestroyerofCheez	cyclone debbie australia activates disaster response plan	1490727698.0	bbc.com	True	621f7p	https://external-preview.redd.it/AsSfQf77fzwTYYXRXBLbGqsCaT79NTkZFjG0jcGBj3E.jpg?width=320&crop=smart&auto=webp&s=0dc0c9d10128fe545ac9315fffe7562e6944e62d		1.0	2	neutralnews	Cyclone Debbie: Australia activates disaster response plan	0.76	1	0	0
LordBandimer	evidently people hide things in the ceiling at my doctors office	1570461292.0	i.redd.it	True	dektaq			8.0	11	mildlyinteresting	Evidently people hide things in the ceiling at my doctors office?	0.84	1	0	0
tito333	electile dysfunction s korea probes sex pillsforvotes claim	1460455400.0	hindustantimes.com	True	4effd0	https://external-preview.redd.it/2PSQJwu6iuj838Fn4nDq4jzfGp16XxQaxgUzdORHQOY.jpg?width=320&crop=smart&auto=webp&s=5a4730ac113c975cdd1d8732c14c6784b4215cb3		1.0	19	nottheonion	Electile dysfunction: S. Korea probes sex pills-for-votes claim	0.79	1	0	0
NJORTHRBIARTR	this bridge made from a semitruck trailer	1560726832.0	i.redd.it	True	c1gbhj	https://preview.redd.it/he3rwylnws431.jpg?width=320&crop=smart&auto=webp&s=2284d420489406fd08d36e437f9a302e347861c6		1.0	12	mildlyinteresting	This bridge made from a semi-truck trailer	0.94	1	0	0
Identitools	kim jong un and donald trump walking while smiling	1528801910.0	i.imgur.com	True	8qi39i	https://external-preview.redd.it/_WF2i1zKSmf6iAV-aXtMpIgPmD4axrW85Uk3cT1VGt4.jpg?width=320&crop=smart&auto=webp&s=76e3e285eaa5148cedb07b5fdc6ca12b795fa014		3.0	19	photoshopbattles	PsBattle: Kim Jong Un and Donald Trump walking while smiling	0.82	1	0	0
TheLostCrusader	sunrise in dubai	1484520642.0	drscdn.500px.org	True	5o70ej	https://external-preview.redd.it/04Qn8ZydMwm1-leSDj6Qs_pNUjLSQ-jUaOqQQlycp3A.jpg?width=320&crop=smart&auto=webp&s=0080e5817cd847653281876976249b79099c6e6b		11.0	234	pic	Sunrise in Dubai	0.89	1	0	0
UserNaemCzechsOut	this bizarre sign i came across	1536889639.0	i.imgur.com	True	9fnzep	https://external-preview.redd.it/arTNqThOf90w_qHbZsf9QHnroTh1_XpUwayibRzPcOQ.jpg?width=320&crop=smart&auto=webp&s=bc5e29bcd8a496d49ce7d2d7a4278b3220d26246		5.0	15	mildlyinteresting	This bizarre sign I came across	0.85	1	0	0
tomccarlson	got tipped in bills at work just now	1567381553.0	i.redd.it	True	cyhe2v	https://preview.redd.it/diirvj8kk2k31.jpg?width=320&crop=smart&auto=webp&s=2b3161666556ee33cfab795c693133db0ad83c12		20.0	51	mildlyinteresting	Got tipped in $2 bills at work just now.	0.81	1	0	0
bigbigsky	this lovely drain in my workplace is made by kkk	1560929638.0	i.redd.it	True	c2e2s2	https://preview.redd.it/4stbkaion9531.jpg?width=320&crop=smart&auto=webp&s=5c8bc1414d0b08cb4b14b711169b0fb750cbefa7		6.0	19	mildlyinteresting	This lovely drain in my workplace is made by KKK.	0.81	1	0	0
Gnome_Sane	dow heads for as stocks rise gold falls ahead of fed	1481661833.0	bloomberg.com	True	5i625g	https://external-preview.redd.it/Ez0g1hwvyN9fJDeiI6vBU1uI0QKOOPAEwW32YywhI7I.jpg?width=320&crop=smart&auto=webp&s=a7eea277718b32f7bba07ac7648e9e41a5cce2f1		0.0	11	neutralnews	Dow Heads for 20,000 as Stocks Rise, Gold Falls Ahead of Fed	0.83	1	0	0
rileywil2018	cats run around diamond head in honolulu hi	1555539814.0	i.redd.it	True	bedwy1	https://preview.redd.it/v3uxa9bzgws21.jpg?width=320&crop=smart&auto=webp&s=bab95e2671d00abac33044b495d764e73b8aff4f		1.0	6	mildlyinteresting	Cats run around Diamond Head in Honolulu, HI	0.71	1	0	0
darkpandaangel	finally got to doing the dishes they were happy	1554653439.0	i.redd.it	True	bahu6b	https://preview.redd.it/vr28q2ac9vq21.jpg?width=320&crop=smart&auto=webp&s=ad20c2a3de9af4848ca56953cc9fcbf738365f19		4.0	26	mildlyinteresting	Finally got to doing the dishes, they were happy!	0.79	1	0	0
borrihong	kid popping giant bubble	1374429681.0	i.imgur.com	True	1irdmk	https://external-preview.redd.it/8Jqm_R7mW1zWq57fZLEBgm7uXXOxZVajgLi83oBXdwM.jpg?width=320&crop=smart&auto=webp&s=0a96a274a95e1f27d5eaf75cbac166954806dd2d		18.0	137	photoshopbattles	Kid popping giant bubble	0.93	1	0	0
Bobasaurus_Rex	grand canyon top at sunset	1496813062.0	imgur.com	True	6frgby	https://external-preview.redd.it/a7VqJPQpscTxMb38mAxa4dCzyeGKD2rDZ7m612Y639k.jpg?width=320&crop=smart&auto=webp&s=6d5dae579500ea62668c53f94783c1a487bab70d		0.0	2	pic	Grand Canyon top at sunset	0.59	1	0	0
bfwilley	yearold driver arrested in pound meth seizure	1503533985.0	denver.cbslocal.com	True	6vn7er	https://external-preview.redd.it/aF3Hw0pzOrAc-CgnGGwgQRqQ5r1L39lDulrDA2ICeTg.jpg?width=320&crop=smart&auto=webp&s=7a29b602825ced1d86d5890412b3e6d6f416be29		0.0	10	usanews	13-Year-Old Driver Arrested In 25-Pound Meth Seizure	0.82	1	0	0
	california added jobs in of us total	1474113107.0	latimes.com	True	536wxv	https://external-preview.redd.it/fZVJQmo4_aAzsGTidTnzNcoCUknAbWcTuABmiarwNlk.jpg?width=320&crop=smart&auto=webp&s=6536fa99f6562772978d763f718baee40247dd26		6.0	32	usanews	California added 63,000 jobs in August, 42% of U.S. total	0.92	1	0	0
TompalompaT	this smiling caterpillar	1569208716.0	i.redd.it	True	d80ww7	https://preview.redd.it/qtxzhmdnh9o31.jpg?width=320&crop=smart&auto=webp&s=e6af4018af1ed8d8b6505a443404bdbcbf99f5a3		2.0	10	photoshopbattles	PsBattle: This smiling caterpillar	1.0	1	0	0
BurgersAndBangers	former islamic state fighter recruits assigned to suicide squads because they were useless	1412370913.0	algemeiner.com	True	2i82s0	https://external-preview.redd.it/nZIGB-l9ENnVUFDRfQvq_ONJVHG4-iuEo0t2O9YFav4.jpg?width=320&crop=smart&auto=webp&s=2cb6c97b563233772022dbec62441ba106a2058f		1.0	6	nottheonion	Former Islamic State Fighter: Recruits Assigned to Suicide Squads ‘Because They Were Useless’	0.69	1	0	0
Fk_th_system	little boy with a pocket knife and cigarette	1490347972.0	i.redd.it	True	617ylm	https://preview.redd.it/a54q1f86sbny.jpg?width=320&crop=smart&auto=webp&s=e7708ab7e9fe72a32ac07f25cbc3fc9010fb09dc		456.0	11819	photoshopbattles	PsBattle: little boy with a pocket knife and cigarette	0.92	1	0	0
Warren4Prez	voters really really want a check on trump this new poll confirms it	1528513552.0	washingtonpost.com	True	8ppybl	https://external-preview.redd.it/3xRoFl0r4fKqqILtKPcT8u1-vF8CL_vV5EXJIc8Jp30.jpg?width=320&crop=smart&auto=webp&s=e0a258ee46d2a28b14684bd8d5426476214d5f37		1.0	34	usnews	Voters really, really want a check on Trump. This new poll confirms it.	0.85	1	0	0
ADavies	halal whale meat on menu as japan tries to boost muslim tourism	1405680866.0	japantimes.co.jp	True	2b1cih	https://external-preview.redd.it/_dQGoYjkTtA0_PoAYIeh0iiwJTQbBEP1OPzP-7nNLP0.jpg?width=320&crop=smart&auto=webp&s=19974174f0893c548a6d1b7eb236658e8bae981a		14.0	24	nottheonion	Halal whale meat on menu as Japan tries to boost Muslim tourism	0.9	1	0	0
FoxtrotUniform11	this old arbys sign	1535652795.0	i.redd.it	True	9bm2j0	https://preview.redd.it/12upx4dou9j11.jpg?width=320&crop=smart&auto=webp&s=78553cd78c8ad1e5d339afbbcd788bad76a7d262		9.0	9	mildlyinteresting	This old Arby's sign	0.72	1	0	0
	this redditors baby being mesmerized by bubbles	1433526758.0	i.imgur.com	True	38p45j	https://external-preview.redd.it/k_R30ur43W8OF2WddX2H3GzCncR-FCp-xr9OKABzjw8.jpg?width=320&crop=smart&auto=webp&s=5528e80795d81bea999f6d817ec282a1f8ccdec3		3.0	35	photoshopbattles	PsBattle: This redditor's baby being mesmerized by bubbles	0.84	1	0	0
