author	clean_title	created_utc	domain	hasImage	id	image_url	linked_submission_id	num_comments	score	subreddit	title	upvote_ratio	2_way_label	3_way_label	6_way_label
Davethemann	the italian declatation of war on north africa black and white photograph	1551730950.0	i.redd.it	True	axbula	https://preview.redd.it/8avep5u8v5k21.jpg?width=320&crop=smart&auto=webp&s=6c5fc9216697307d85401e9e82ab8b5c48245337		3.0	92	fakehistoryporn	The Italian Declatation of War on North Africa (1940, black and white photograph)	0.96	0	2	2
ToiletRollTubeGuy	this pile of trimmed pubic hair on the floor	1565003652.0	i.redd.it	True	cm9nje	https://preview.redd.it/e53bqecu5me31.jpg?width=320&crop=smart&auto=webp&s=59bcc37effd48cbd2a81d0226594fb0021edf358		118.0	3496	misleadingthumbnails	This pile of trimmed pubic hair on the floor	0.92	0	2	2
trd86	urine inspection pirate bot	1563375393.0	i.imgur.com	True	cedxje	https://external-preview.redd.it/0h7neOfQu9j7w8Csu3mQKbbuX7anTma_dTk83JuOeEs.jpg?width=320&crop=smart&auto=webp&s=af2e253b114571d259d29cc37aee8c8b402e5bca		2.0	4	pareidolia	Urine inspection Pirate bot	0.83	0	2	2
sleepy_wombat	addicted to speed	1491926712.0		True	dg4gsmb	http://i.imgur.com/qGzzTWD.jpg	64q4o5		14	psbattle_artwork	Addicted to speed		0	2	4
Cmatthewman	luke skyrocker	1460725207.0		True	d23x09b	http://i.imgur.com/KvBDP4X.jpg	4eph6e		36	psbattle_artwork	Luke Skyrocker		0	2	4
LanMega007	infographics show why you will never be rich	1519064382.0	streamable.com	True	7yoqoo	https://external-preview.redd.it/NqL7xpg4wfPwS9JCX_dpplf9sBrsSjG2Xk-yFj9ovDg.jpg?width=320&crop=smart&auto=webp&s=e11a24f635e49a21a64e9a1c009457577984ef86		1.0	46	savedyouaclick	"Infographics Show ""Why You Will Never Be Rich"" | The video is unclear, you're either just born rich or poor, or you went to College in order to be rich (aka you got a degree). The definition of rich depends on you."	0.91	0	2	5
charlottesometimes91	giant cat or tiny moon	1561271260.0	i.redd.it	True	c405ci	https://preview.redd.it/vq3h4cmiv1631.jpg?width=320&crop=smart&auto=webp&s=9b480c1b567c2cd371af58f62254a72f9a944f3e		3.0	26	confusing_perspective	Giant cat or tiny moon??	0.79	0	2	2
meinaccount	baby moon	1488428270.0		True	deefhkp	http://i.imgur.com/zQzPloJ.jpg	5x0i2z		3	psbattle_artwork	Baby Moon		0	2	4
SmashedBug	bear	1444827662.0		True	cvzbzpa	http://i.imgur.com/9tAS1mS.jpg	3ope8t		384	psbattle_artwork	bear		0	2	4
engineerhatberg	altleft instigators charging unite the right rally charlottesville virginia	1502861538.0	i.imgur.com	True	6u001p	https://external-preview.redd.it/LPTH3RKKVXSD28fB-E2KzK1Qi16DQqCgfwQNVFjKpL4.jpg?width=320&crop=smart&auto=webp&s=f6432ddecce565e8a08c8856dda816a2f6b3d8d4		1.0	19	fakehistoryporn	Alt-Left instigators charging Unite The Right rally, Charlottesville, Virginia (2017)	0.72	0	2	2
Pendley	this grappler breaking an opponents leg	1530032507.0	i.redd.it	True	8u1oxh	https://preview.redd.it/pprdma4nmd611.gif?width=320&crop=smart&format=png8&s=243cf86ae77d9133552d8b78cf5a9cce74df4535		1.0	3	confusing_perspective	This grappler breaking an opponents leg.	0.6	0	2	2
CIANNAH	i tried shortly after the competition started	1441835075.0		True	cuw2qd5	http://i.imgur.com/PHYiR82.jpg	3jy9ab		9	psbattle_artwork	I tried shortly after the competition started		0	2	4
jayteepee	always keep the gun firmly in hand	1451746950.0	i.imgur.com	True	3z5bhn	https://external-preview.redd.it/pztByslXbVCy5520Fr668Mla3CHB6Nn8EwYr01Yhgcg.jpg?width=320&crop=smart&auto=webp&s=192efe005fba0941db47d6123e439e660627a96d		9.0	121	propagandaposters	Always keep the gun firmly in hand (1974)	0.96	0	1	5
LogoMan596	these plants are having a ruff life	1529472949.0	i.redd.it	True	8sftjz	https://preview.redd.it/4moimwwse3511.jpg?width=320&crop=smart&auto=webp&s=bf1126fc6ac82e1d7596b6da7282cbed6d3aab8f		0.0	3	pareidolia	These plants are having a ruff life	0.64	0	2	2
Maymayfish	gremlins	1565442532.0		True	ewi8pks	https://i.imgur.com/eEtVD40.jpg	cohl4c		482	psbattle_artwork	Gremlins		0	2	4
FullNoodleFrontity	deen martin	1434039391.0		True	cs35saj	http://i.imgur.com/aWpSn6M.jpg	38gf44		3	psbattle_artwork	Deen Martin		0	2	4
ArchangelPT	high as fuck	1410793258.0	i.imgur.com	True	2ggpk1	https://external-preview.redd.it/XYUSvxI-X_tEnpDwVrh2LE-Nyg1WKh4VAeDaMco7_ho.jpg?width=320&crop=smart&auto=webp&s=51a888dd96434dd8a23a8a5e2a4ae1079d5156d7		38.0	4413	pareidolia	High as fuck	0.94	0	2	2
WittyRepost	war is hell	1401350028.0		True	chtuen6	http://i.imgur.com/boc2Y92.jpg	26qngr		218	psbattle_artwork	War is Hell		0	2	4
void_fish	tetrix ornata unknown vices	1551739239.0	i.redd.it	True	axdgz7	https://preview.redd.it/k5sgln0nj6k21.png?width=320&crop=smart&auto=webp&s=76939b1cde333240957140e6361b3dc32e7f3461		0.0	2	fakealbumcovers	Tetrix Ornata - Unknown Vices	0.75	0	2	1
What_No_Cookie	he might be lost	1391631824.0		True	cf7wrj1	http://i.imgur.com/zQadBHU.jpg	1x3b7k		453	psbattle_artwork	He might be lost.		0	2	4
KaijuHeadlock	imgur	1414103227.0		True	clhytwd	http://i.imgur.com/IJmD4HK.jpg	2k4aqz		1	psbattle_artwork	Imgur		0	2	4
rossmoney	kind of surprised washer	1492208545.0	i.redd.it	True	65fn6o	https://preview.redd.it/ax2bm3whglry.jpg?width=320&crop=smart&auto=webp&s=5f05e34dfd4d863c7fee070f2d94d792ccbec555		0.0	3	pareidolia	Kind of surprised washer.	1.0	0	2	2
funny_SS	this is the only picture on reddit summed up my camera and nearly disowned me	1448567908.0	imgur.com	True	3udu5q	https://external-preview.redd.it/BqRCKPKPM9gVXkH24fpft4vIuW_mMLm5xi0Gj_Rb8Z8.jpg?width=320&crop=smart&auto=webp&s=a29a4b838acf9d76803b1f74f77e910b4e9f8754		20.0	43	subredditsimulator	This is the only picture on reddit summed up my camera and nearly disowned me	0.98	0	2	3
tori_bird	control the party	1484315911.0		True	dcdiwlt	http://i.imgur.com/tB7nK3E.jpg	5ngkgl		3	psbattle_artwork	Control the party		0	2	4
PhotoshopPhilipp	shaaaaaark	1442548036.0		True	cv5ihlw	http://i.imgur.com/oqnpdvb.jpg	3ldaao		1	psbattle_artwork	Shaaaaaark		0	2	4
eam1188	its a deadly game	1365832452.0		True	c9e9u7u	http://i.imgur.com/G12i89y.jpg	1c95kt		1	psbattle_artwork	It's a deadly game		0	2	4
magsinoevil	shake it off	1480724608.0		True	dapxa03	http://i.imgur.com/CmPb6Bg.jpg	5g4ykx		72	psbattle_artwork	Shake It Off!		0	2	4
pics_SS	this nightsky shot of a rosa parks protesting by taking a paralyzed grasshopper into my cars tire	1525334306.0	i.redd.it	True	8gopzh	https://preview.redd.it/j2k0lbpdquuz.jpg?width=320&crop=smart&auto=webp&s=e2cad69296950e4c6ab668c1649de683b332878f		20.0	846	subredditsimulator	This nightsky shot of a ♥. Rosa Parks protesting by taking a paralyzed grasshopper into my cars tire	0.97	0	2	3
tanne_sita_jallua	thats my secret im always making fun of religion	1379601149.0		True	ccbex87	http://i.imgur.com/qd6qplG.jpg	1mowjb		3	psbattle_artwork	Thats my secret. I'm always making fun of religion.		0	2	4
Dakevin10	will trump shut down pirate bay	1473615600.0	torrentfreak.com	True	529ndt	https://external-preview.redd.it/y_mPIUSWyiFm4T5KxLMEcOkNGF2WuYimWtqT4WWAbJE.jpg?width=320&crop=smart&auto=webp&s=39da8835d0ca6213338ddc00f3487da3ab351d81		2.0	108	savedyouaclick	Will Trump shut down pirate bay? | No	0.97	0	2	5
graphleek	apparition of pakistanis pulling a truck with ropes on a partially cloudy sky and rocks on the beach of roses	1425917666.0		True	cp97xmo	http://i.imgur.com/RwaFz9t.jpg	2yflxd		2	psbattle_artwork	apparition of 13 pakistanis pulling a truck with ropes on a partially cloudy sky and 4 rocks on the beach of roses		0	2	4
pamtar	saki time	1403914321.0	imgur.com	True	29a9u5	https://external-preview.redd.it/v0FR_yWn7qfyMe406MmQPe9U4H8YP_oM0hHm1CED90U.jpg?width=320&crop=smart&auto=webp&s=727c525401aa41eed0b4f250d4d7e596209ba439		1.0	6	pareidolia	Saki Time!	0.88	0	2	2
dusty_whale	cocaine cat	1462163905.0		True	d2papdq	http://i.imgur.com/7BVWwgl.jpg	4hase2		6	psbattle_artwork	Cocaine Cat		0	2	4
breakalim	just reach in and grab the giblets	1422448289.0		True	co3fb69	http://i.imgur.com/KtBeNwO.jpg	2tum6v		1	psbattle_artwork	just reach in and grab the giblets		0	2	4
Ali-009	european recovery program us	1474441375.0	i.redd.it	True	53rz51	https://preview.redd.it/vldo5y7nxtmx.jpg?width=320&crop=smart&auto=webp&s=21bb0b41fc725823a58633ff7a0b29a34273233a		12.0	52	propagandaposters	"""European Recovery Program"", US, 1947"	0.99	0	1	5
kashmasheen	sleep shatter	1493998204.0	i.imgur.com	True	69fd9u	https://external-preview.redd.it/XtLUJ5-oIPwijU7shsl_JngZePjl-SzMvK8HlVRUook.jpg?width=320&crop=smart&auto=webp&s=4e8a921c197054313d17bbf84a075f4e73ae2308		1.0	5	fakealbumcovers	Sleep - Shatter	0.68	0	2	1
TheAngrySpanker	look what ive got for you	1381424259.0		True	ccoyvvo	http://i.imgur.com/qOpHSKm.jpg	1o4npr		5	psbattle_artwork	Look what I've got for you!		0	2	4
wtfact	a bird skeleton sticking down from my ceiling vent	1518844950.0	i.redd.it	True	7y4smd	https://preview.redd.it/xm8za6qn1ng01.jpg?width=320&crop=smart&auto=webp&s=c571f13f2ff66b41a4c7e95229f7e215b9b67351		3.0	4	misleadingthumbnails	A bird skeleton sticking down from my ceiling vent.	0.67	0	2	2
VirtualBlaze	wesley the empty nothing	1504305816.0	i.redd.it	True	6xi2bl	https://preview.redd.it/wphf0ch0ocjz.jpg?width=320&crop=smart&auto=webp&s=0cc21b50ffc1cc7f6a392f27231ae635b0154750		2.0	9	fakealbumcovers	Wesley - The Empty Nothing	0.91	0	2	1
skaol	it loves trash	1555757174.0	i.redd.it	True	bfayfe	https://preview.redd.it/zrn1p6ebfet21.jpg?width=320&crop=smart&auto=webp&s=f4e9d84183db0c233d4cce3f4365b81e5060ffd7		0.0	2	pareidolia	It loves trash	1.0	0	2	2
swedish_memes47	end of the world and end of gamer girl bath water	1563520973.0	i.redd.it	True	cf4hnk	https://preview.redd.it/epveo1n2p7b31.jpg?width=320&crop=smart&auto=webp&s=8641bf47207fb4c1fd8b9a0bcf40e37e098a8f27		10.0	96	fakehistoryporn	End of the world and end of Gamer Girl Bath Water (2019)	0.97	0	2	2
	would	1498020263.0		True	dj6rqyz	https://i.imgur.com/9WUa035.jpg	6ijh26		2	psbattle_artwork	Would		0	2	4
almostaportal	half a shark	1567696936.0	i.redd.it	True	d027yi	https://preview.redd.it/f1ckraucmsk31.jpg?width=320&crop=smart&auto=webp&s=df885a732d021b07e064160cd3131115631a53b2		2.0	38	pareidolia	Half a shark	0.88	0	2	2
smurferdigg	motivation	1571016806.0		True	f3ofvlw	https://i.imgur.com/CEKUuN8.jpg	dhfoos		4	psbattle_artwork	Motivation		0	2	4
sashaatx	my blinds are tripping balls	1490915385.0	m.imgur.com	True	62hjph	https://external-preview.redd.it/AmLRJ603QoPSBpIB-adjNw8gn5W1afYuLBQQsH5eLPs.jpg?width=320&crop=smart&auto=webp&s=e6ff3fb95f9ab4992e40de5e9a7ed2df61e3a15b		0.0	3	pareidolia	My blinds are tripping balls	0.8	0	2	2
Kela3000	not the right place not the right time	1360339572.0		True	c8bmbl4	http://i.imgur.com/IkF44WK.jpg	184x4e		5	psbattle_artwork	Not the right place, not the right time		0	2	4
CFappas	finish him	1433112514.0		True	crr98at	http://i.imgur.com/Fbm4z2q.jpg	37znmw		6	psbattle_artwork	FINISH HIM		0	2	4
mybustersword	we brushed the dogs and ended up with a third	1468609242.0	imgur.com	True	4t0qgv	https://external-preview.redd.it/Qs4oZYI0S8VZYevQNypIj80FVPxkhuJOxS17ml3LXAY.jpg?width=320&crop=smart&auto=webp&s=0c04933b2b4bd73fefd23686837dd2dd01dffd93		0.0	5	pareidolia	We brushed the dogs and ended up with a third	0.86	0	2	2
NewJerseyFreakshow	marco rubio climbs over garden wall for forbidden midnight meeting with super pac	1438841753.0	theonion.com	True	3fz2pg	https://external-preview.redd.it/rpB8TIHFI4QrmIqPgQKkk4edDZwdDDTJbPFtJrOvVcU.jpg?width=320&crop=smart&auto=webp&s=f32d9d6c67c4328393fb4ebf1cc1705485838f3e		0.0	9	theonion	Marco Rubio Climbs Over Garden Wall For Forbidden Midnight Meeting With Super PAC	0.92	0	2	1
dwaxe	cocacola marketing strategist named new united states pr laureate	1452543672.0	theonion.com	True	40inv4	https://external-preview.redd.it/9MsdYibaXycfyXaQHcUVwt31jAEj0J_UBEP2JpaOEZ4.jpg?width=320&crop=smart&auto=webp&s=590aa4a70440fa8e627e3e1174c9f45eb893f3e1		0.0	2	theonion	Coca-Cola Marketing Strategist Named New United States PR Laureate	1.0	0	2	1
SerHeimord	th grader comes home with disturbing newsthen mom realizes her worst nightmare is coming true	1463530254.0	web.archive.org	True	4jty09	https://external-preview.redd.it/TkXFvCV0LFMSNofzG4VH2cERB0PT6eSCLc2Gyg5eycg.jpg?width=320&crop=smart&auto=webp&s=557f3059dd5a3f5a4048a96e9ea9095f11e64b4e		10.0	21	savedyouaclick	4th Grader Comes Home With Disturbing News—Then Mom Realizes Her “Worst Nightmare” Is Coming True | Her daughter is snobbing another kid	0.82	0	2	5
NotTheSicario	welcome to fish n fish we are all out of fish today sir	1475332624.0		True	d89l0vg	http://i.imgur.com/kb5QqEI.jpg	55ddvz		3	psbattle_artwork	Welcome to Fish N Fish! We are all out of fish today sir.		0	2	4
nuwsreedar	soviet no god here	1488303972.0	i.imgur.com	True	5wpg4c	https://external-preview.redd.it/H8Y9ES_xSIh9V5_fFVe-tN8bbm-DmqxqIecaYwBykpA.jpg?width=320&crop=smart&auto=webp&s=17b0aa51dc1fab2fef22540af7c15a698cc1be48		62.0	749	propagandaposters	Soviet Propaganda 1975: No God here	0.97	0	1	5
stonemanm	world war two posters warning people against careless talk	1512789030.0	madefrom.com	True	7ik8uo	https://external-preview.redd.it/iIQqc7Fm-1h9bHAymtYLE9WoP4Wn-JE1hM1-2gl7L24.jpg?width=320&crop=smart&auto=webp&s=cf4c65cd409411c68f0bf7bb8b68ca5581cea0e7		0.0	15	propagandaposters	"World War Two posters warning people against ""careless talk"""	0.91	0	1	5
teenagersGPT2Bot	me and my friends at a local bar	1570966238.0	i.imgur.com	True	dh9ey4	https://external-preview.redd.it/ESPM-tTuK3werLgfWG_wBsw_trUSDNU4bI5s2jVRAgQ.png?width=108&crop=smart&auto=webp&s=6bdf4d9c8ec6b3100f803c1cf0848f49a5aee344		63.0	2	subsimulatorgpt2	Me and my friends at a local bar	1.0	0	2	3
cnnonymous	isis loves muhammad	1448787435.0		True	cxgm302	http://imgur.com/Q0lJJ8W.jpg	3uokoo		17	psbattle_artwork	ISIS LOVES Muhammad		0	2	4
reddward	jayz	1344323049.0		True	c5pdiyl	http://i.imgur.com/tDyZB.jpg	xs9fu		6	psbattle_artwork	Jay-Z?		0	2	4
worldnews_SS	us general killed in infighting among rival islamic groups across the eu if it is fomenting in ukraine as up to now barred labour has become increasingly popular in recent weeks international naval forces operating in the regency hotel	1473011900.0	cbc.ca	True	5153vj	https://external-preview.redd.it/ZIHRJOCiiIUDVaeTt4EhzW0hBp6e5U1ZHEBh3OZ4Cd8.jpg?width=320&crop=smart&auto=webp&s=1402d52dbe2f4d0afaac37332e5b37b13cda4187		20.0	9	subredditsimulator	US general killed in infighting among rival Islamic groups across the EU if it is fomenting in Ukraine as up to 100,000 now barred, Labour has become increasingly popular in recent weeks, international naval forces operating in the Regency hotel	1.0	0	2	3
CaffeineC8H10N4O2	ok so no faceswapping	1436548489.0		True	csyro7v	http://i.imgur.com/mOH9nTc.jpg	3cqwgt		10	psbattle_artwork	ok.. so no faceswapping..		0	2	4
thrawn0o	mrnotsobig now are we	1504271289.0		True	dmf7zys	http://i.imgur.com/2Xslhiq.jpg	6xcqy1		5	psbattle_artwork	Mr.Not-So-Big now, are we?		0	2	4
ffonzz	about to light the hob	1563141516.0	i.redd.it	True	cd8vif	https://preview.redd.it/x56tkpeqcca31.png?width=320&crop=smart&auto=webp&s=4f799edefef184c55be7a0234f10bab65c73c033		1.0	6	misleadingthumbnails	About to light the hob	0.87	0	2	2
eschmaltz	smart and happy	1516200993.0	i.redd.it	True	7r1hj2	https://preview.redd.it/8t2kgoeh6na01.jpg?width=320&crop=smart&auto=webp&s=9cb8367b7b2531f54b4ceef3d92530dfc189c0b0		1.0	2	pareidolia	smart AND happy	0.67	0	2	2
MyNameIsGriffon	elderly man feeling useless in retirement wishes he could go back to feeling useless at work	1556292637.0	local.theonion.com	True	bhnme3	https://external-preview.redd.it/Y-iGHV_Nob3QwFBnr1MfRFjlj_YI-5A8HjZm2l4rCr8.jpg?width=320&crop=smart&auto=webp&s=b1fc2a560227a0e8180135af06ff4da565e0acd5		0.0	123	theonion	Elderly Man Feeling Useless In Retirement Wishes He Could Go Back To Feeling Useless At Work	0.99	0	2	1
ApiContraption	other discussions	1387815811.0		True	ce8j2ag	http://i.imgur.com/NS8XFFp%2ejpg	1tjc0s		1	psbattle_artwork	Other Discussions		0	2	4
ApiContraption	other discussions	1389552200.0		True	censvoy	http://i.imgur.com/193Itno%2ejpg	1v1lc4		1	psbattle_artwork	Other Discussions		0	2	4
ApiContraption	cutouts	1406586370.0		True	cjaft21	http://i.imgur.com/FRDYIeT%2ejpg	2bzkq9		1	psbattle_artwork	cutouts		0	2	4
	dark knight	1536321335.0		True	e5ju1g0	https://i.imgur.com/jk98d8Y.jpg	9do1us		12	psbattle_artwork	Dark Knight		0	2	4
PaperkutRob	kids these days	1401910636.0		True	chz68xs	http://i.imgur.com/5xTHWj6.jpg	27ayta		28	psbattle_artwork	Kids these days...		0	2	4
	nasa said follow him so we can explore his galaxy	1349116433.0		True	c6g2v8f	http://i.imgur.com/59QhB.jpg	10n0d1		20	psbattle_artwork	NASA said follow him so we can explore his galaxy.		0	2	4
AlphaKiloAlpha	couldnt tell if this was real or not stomped anyway	1452376429.0	imgur.com	True	408ag3	https://external-preview.redd.it/ErbF_H6D7FYeQF-nG7SDU0J85XK876Q6vPtttXj2YLE.jpg?width=320&crop=smart&auto=webp&s=1aad244c2d843f2d90954a5d8c495a1809a2ec10		1.0	11	pareidolia	Couldn't tell if this was real or not... stomped anyway.	0.83	0	2	2
HexhammerIV	hes seen some st	1532977335.0	i.redd.it	True	936xc2	https://preview.redd.it/28c067p5v4d11.jpg?width=320&crop=smart&auto=webp&s=00a40e6117f59fe9f1a1246dc2da9ef97cbda1bd		2.0	9	pareidolia	He’s seen some s**t	1.0	0	2	2
jamerst	hey who turned out the lights	1435237311.0		True	csi691n	http://i.imgur.com/YpkuJl8.jpg	3alv66		2	psbattle_artwork	Hey! Who turned out the lights?		0	2	4
TheOddball7	muhammad ali dodges punches in seconds from michael dokes circa	1556192769.0	i.redd.it	True	bh7n1y	https://preview.redd.it/x4i5ro5keeu21.png?width=320&crop=smart&auto=webp&s=72bde261261b417766e8ad8c9a783a1bf29f78da		0.0	26	fakehistoryporn	Muhammad Ali dodges 21 punches in 10 seconds from Michael Dokes (circa 1977)	0.97	0	2	2
Sip_the_bleach	oxygen weguwator	1535568879.0	i.redd.it	True	9bc3q6	https://preview.redd.it/8d12an75x2j11.jpg?width=320&crop=smart&auto=webp&s=b0b334af3783ce71669c36c010e186d9a1a1afd0		0.0	2	pareidolia	Oxygen weguwator	1.0	0	2	2
TheBlazingPhoenix	kickass	1418055588.0		True	cmosrp3	http://i.imgur.com/SbJtMAr.jpg	2ondsg		263	psbattle_artwork	kick-ass		0	2	4
Torporific	please walk in a straight line while reciting the alphabet backwards	1374640264.0		True	cb921r2	http://i.imgur.com/M5JbBvB.jpg	1ix2k0		62	psbattle_artwork	Please walk in a straight line while reciting the alphabet backwards		0	2	4
ms_pain	next season on better call saul	1481982220.0		True	dbb16j5	http://i.imgur.com/2HQDRjW.jpg	5iu3fz		3	psbattle_artwork	Next season on Better Call Saul		0	2	4
dustinmikk	oh hey there	1354727139.0		True	c7bnl5s	http://i.imgur.com/bSgR2.jpg	14bpwq		275	psbattle_artwork	Oh Hey There!		0	2	4
AspireAgain	complete victory if you eat less bread lbs per person per week wwii ministry of food poster urging britons to eat less bread during wartime imperial war museum x	1499694276.0	i.redd.it	True	6meixm	https://preview.redd.it/l6tocvt2rr8z.jpg?width=320&crop=smart&auto=webp&s=33f6d3475f021a18dac1f203b0103407ec3c37be		4.0	32	propagandaposters	"""Complete Victory If You Eat Less Bread... 4 lbs Per Person, Per week."" WWII Ministry of Food poster urging Britons to eat less bread during wartime. Imperial War Museum. [534x800]"	0.95	0	1	5
mochalion	bill cosby enjoying pudding on the cosby show circa	1518894295.0	i.redd.it	True	7y8lw0	https://preview.redd.it/q6pu13y1ntg01.jpg?width=320&crop=smart&auto=webp&s=4c2e51231380cd92a5b60617c13f0c8d1cef50e8		0.0	11	fakehistoryporn	Bill Cosby enjoying pudding on the Cosby Show ~ circa 1987	0.74	0	2	2
adawkin	serbia is part of the anticommunist front too nazi for occupied serbia world war ii	1553439988.0	i.redd.it	True	b4xb4d	https://preview.redd.it/ysems50213o21.jpg?width=320&crop=smart&auto=webp&s=c9d9ee97a7ecab0d025b4b6994ff4f2b972f5ba6		10.0	195	propagandaposters	Serbia is part of the Anti-Communist front too (Nazi for occupied Serbia) (World War II)	0.98	0	1	5
Kyrthis	what i saw when i needed to put my pencil down to go get something	1527802005.0	i.redd.it	True	8nm90w	https://preview.redd.it/owu75qt8e9111.jpg?width=320&crop=smart&auto=webp&s=e48a9cf7f6e45062398c0dc46a443b7d1745d5f6		4.0	3	pareidolia	What I saw when I needed to put my pencil down to go get something.	1.0	0	2	2
Krawlngchaos	rapey on bubbles	1413587592.0		True	clchtr0	http://i.imgur.com/QP0b7gk.jpg	2jh4gx		1	psbattle_artwork	Rapey on bubbles		0	2	4
Diginixy	this faucet has seen some shit	1510637740.0	imgur.com	True	7ctimw	https://external-preview.redd.it/pEyb2w06huUTKPZYBQugmxHaU3N0VL6-bVx2xwX1xN4.jpg?width=320&crop=smart&auto=webp&s=056e40aa4e91547150ff0978eb35b9dd3308da9b		0.0	28	pareidolia	This faucet has seen some shit	0.91	0	2	2
GoblinGuts	a little dragon in a shadow cast from a plant	1558217711.0	i.redd.it	True	bq9jqq	https://preview.redd.it/86pqertxi1z21.jpg?width=320&crop=smart&auto=webp&s=718d88c1d1c2eda6458b8df354514bbf8abf8444		0.0	4	pareidolia	A little dragon in a shadow cast from a plant.	0.75	0	2	2
theforgottenchild	oli sykes kiditssoshit	1404353028.0		True	cin6ke1	http://i.imgur.com/xcQyEVa.jpg	29ogcu		1	psbattle_artwork	Oli Sykes Kid^it's^so^shit		0	2	4
milvus	this time king kong came prepared	1389091041.0		True	cejhdfm	http://i.imgur.com/2qoMDgt.jpg	1uktzv		62	psbattle_artwork	This time King Kong came prepared		0	2	4
S0l0Pro	new level of hunting	1495722894.0		True	di0z0y1	http://i.imgur.com/q864etw.jpg	6d9pxi		14	psbattle_artwork	New level of hunting		0	2	4
vadsvads	he has seen some things	1536132576.0	i.redd.it	True	9d44jb	https://preview.redd.it/84hx15i2hdk11.png?width=320&crop=smart&auto=webp&s=df99eb1ef49da406583595dd7ec2674504974ef6		0.0	10	pareidolia	He has seen some things...	0.92	0	2	2
jakegest	imgur	1432601291.0		True	crktp98	http://i.imgur.com/MATwkrL.jpg	379mwj		2	psbattle_artwork	Imgur		0	2	4
Atru515	take on me	1517805661.0		True	dtr85wg	https://i.imgur.com/XxaeuSM.jpg	7vaqht		597	psbattle_artwork	Take On Me		0	2	4
Geeglio	fatah palestine palestinian national liberation movement	1535202915.0	i.redd.it	True	9a6p1c	https://preview.redd.it/5nqkyhooo8i11.jpg?width=320&crop=smart&auto=webp&s=6b1cd5ab654ef8ef8316f2c8fa67188c997c820f		10.0	100	propagandaposters	"""Fatah - Palestine"", Palestinian National Liberation Movement, 1981"	0.96	0	1	5
topatisen	final battle	1432717424.0		True	crmbdte	http://i.imgur.com/dD2hO3x.jpg	37fl17		4	psbattle_artwork	Final Battle!		0	2	4
Smeyke	lindsey nelson the land unknown	1510560338.0	i.redd.it	True	7clpq0	https://preview.redd.it/g4pyrfnv9pxz.jpg?width=320&crop=smart&auto=webp&s=77a3e0b03ea70e3c5b9ea38d18f73fa5ee1a1153		3.0	4	fakealbumcovers	Lindsey Nelson – The Land Unknown	0.75	0	2	1
Full_iced	nasa loses its million mars climate orbiter due to a conversion error	1548027153.0	i.redd.it	True	ai3tct	https://preview.redd.it/9vwuzhuwxnb21.png?width=320&crop=smart&auto=webp&s=47d49592bd194ff7dcc1d97a14be4e1558932e19		2.0	127	fakehistoryporn	NASA loses its $125-million Mars Climate Orbiter due to a conversion error (1999)	1.0	0	2	2
vpounder	the sneak attack	1396913363.0		True	cgmot79	http://i.imgur.com/qrucR9X.jpg	22exj7		98	psbattle_artwork	The Sneak Attack!		0	2	4
eggbert1234	tree guy	1533678304.0	i.redd.it	True	95fyne	https://preview.redd.it/y210ptohrqe11.jpg?width=320&crop=smart&auto=webp&s=bd71ac70fe6366c6ef2f23693ca12e4adb9ee5c6		1.0	4	pareidolia	Tree Guy	0.84	0	2	2
Sip_the_bleach	winston churchill when informed of nazi blitz circa	1508865581.0	i.redd.it	True	78h8tl	https://preview.redd.it/54ca04cjattz.jpg?width=320&crop=smart&auto=webp&s=441dad70e39c9af5a9622acd10263d78b1f6ad13		0.0	56	fakehistoryporn	Winston Churchill when informed of nazi blitz. Circa 1941	0.95	0	2	2
PSBBot	available here	1417461287.0		True	cmi4515	http://i.imgur.com/lkx4X4m.jpg	2nyskd		0	psbattle_artwork	available here		0	2	4
plezmoid	there now its a tomato with creepy features	1407668883.0		True	cjm4uh2	http://i.imgur.com/Ayt6d7d.jpg	2d3ems		5	psbattle_artwork	There, now its a tomato with creepy features.		0	2	4
Bigtris	getting a little help	1403760499.0		True	cihd7mg	http://i.imgur.com/R9eTbYJ.jpg	294e90		7	psbattle_artwork	Getting a little help		0	2	4
fool_on_the_hill	worried plane crosspost from rmilitaryporn	1377288123.0	i.imgur.com	True	1kyoab	https://external-preview.redd.it/wiIMmItqNuqzOP1FHFpm3zeM4OMUMf8SPEwjG7T20wU.jpg?width=320&crop=smart&auto=webp&s=4ea6d8d59dd6631f0a7f5fd19123e6baba624ead		2.0	5	pareidolia	Worried plane (crosspost from /r/MilitaryPorn/)	0.67	0	2	2
christ_wearing_nikes	the olympics newest sport	1536767980.0		True	e5umj4f	https://i.imgur.com/jb8XuYj.jpg	9eblom		10	psbattle_artwork	The Olympics' newest sport!		0	2	4
Simmo5150	the mothers nasal retentive calliope music	1535120397.0	i.redd.it	True	99xsst	https://preview.redd.it/klvcrtdfv1i11.jpg?width=320&crop=smart&auto=webp&s=191306ef656623408c3a7297bd980067ed594948		1.0	7	fakealbumcovers	The Mothers - Nasal Retentive Calliope Music	0.71	0	2	1
Kazaxat	the bottom always turtles	1409019037.0		True	ck0jk1b	http://i.imgur.com/rMaoDCQ.jpg	2ek0mj		8	psbattle_artwork	The bottom? Always turtles.		0	2	4
gifs_SS	look how fast is a little spaceship	1489625900.0	i.imgur.com	True	5zniwd	https://external-preview.redd.it/H88mPFhAsa5TsFmyJwgxd8TMcn99GEmw_QtRnA0iNeI.gif?width=320&crop=smart&format=png8&s=fdd5d9b81f5728f4b2c2316a0c029fc51ada8c82		18.0	32	subredditsimulator	Look how fast is a little spaceship	0.95	0	2	3
VerbNounPair	nemo deep dive	1555813971.0	i.redd.it	True	bfk7d0	https://preview.redd.it/ogymdj554jt21.png?width=320&crop=smart&auto=webp&s=752d756c1b4bafe949ea966e2b64111adf3fc89a		1.0	3	fakealbumcovers	Nemo 33 - Deep Dive	0.67	0	2	1
pcspain	my friends and i seem to be vastly different sizes	1496549563.0	i.redd.it	True	6f5iot	https://preview.redd.it/4irmpmso0k1z.jpg?width=320&crop=smart&auto=webp&s=c876eb0789c5f6d89ab6dfb68eef18ef118af61d		41.0	1647	confusing_perspective	My friends and I seem to be vastly different sizes.	0.93	0	2	2
